id,key,summary
516331,UNBO-3201,AWS build fails
516318,UNBO-3200,Review for Automation - Review the File URL structure
516313,UNBO-3199,Sanity web preview crashing when unpublished parent is set
516304,UNBO-3198,Add Highlights field to the news article schema
516290,UNBO-3197,Bowen and Craggs survey script not loading
516202,UNBO-3196,Github Dependency upgrade is no longer working
516199,UNBO-3195,Sprint 47 automation tasks
516185,UNBO-3194,Practice Cypress UI test writing and structuring
516167,UNBO-3193,Clean up AWS dev sites
516044,UNBO-3192,Stop brand names being translated when using in-built browser translation tool
516037,UNBO-3191,Percy is firing before Theme button is displayed
516031,UNBO-3190,Info box image is appearing outside the module 
515933,UNBO-3189,Add Carribean to test data json & run Terraform scripts
515917,UNBO-3188,Add linting to .mts files
515912,UNBO-3187,12.4 landmarks should be unique
515852,UNBO-3186,Description list - formatting 
515842,UNBO-3185,"The ""Latest films"" promo styling has gone a little awry "
515834,UNBO-3184,Tighten up the NR synthetic header tag tests 
515831,UNBO-3183,Test and implement the Azure news signup
515830,UNBO-3182,Prevent blank IR listings failing the build 
515828,UNBO-3181,"The canonical tag for the sites is ""localhost:3000"""
515760,UNBO-3180,Test Crownpeak SSO
515756,UNBO-3179,Add an API header that Akamai has whitelisted
515731,UNBO-3178,Archiving process for older content
515637,UNBO-3177,Cypress binary is missing when CI pulls a never version than listed in package.json
515624,UNBO-3176,Create monitor to check builds are running
515612,UNBO-3175,Make Azure Function workspaces work locally
515474,UNBO-3174,Filters missing on standards in the accessibility hub site
515452,UNBO-3173,DQM 12.4 Landmarks should be unique
515451,UNBO-3172,Enable a description field for 'Locations'
515412,UNBO-3171,Configure News signup to go though Azure
515322,UNBO-3170,Add document.title checks using cy.title()
515302,UNBO-3169,UCO: SocialMedia
515301,UNBO-3168,UCO: SocialAccounts
515300,UNBO-3167,UCO: Search
515299,UNBO-3166,UCO: RelatedBrands
515298,UNBO-3165,UCO: NewsTopicBanner
515297,UNBO-3164,UCO: NewsSignupForm
515296,UNBO-3163,UCO: InitiativeCtaPanel
515295,UNBO-3162,UCO: GoalProgress
515294,UNBO-3161,UCO: GoalDashboard
515293,UNBO-3160,UCO: Footer
515292,UNBO-3159,UCO: CustomForm
515291,UNBO-3158,UCO: AlternativeOilSearch
515234,UNBO-3157,Walls  - Add all automation test results to the the Issues log
515233,UNBO-3156,Magnam - Add all automation test results to the the Issues log
515231,UNBO-3155,Hellmans  - Add all automation test results to the the Issues log
515230,UNBO-3154,Knorr - Add all automation test results to the the Issues log
515229,UNBO-3153,OMO - Add all automation test results to the the Issues log
515226,UNBO-3152,Rexona - Add all automation test results to the the Issues log
515224,UNBO-3151,Pepcident - Add all automation test results to the the Issues log
515223,UNBO-3150,Tresamme - Add all automation test results to the the Issues log
515222,UNBO-3149,Dove - Add all automation test results to the the Issues log
515221,UNBO-3148,Persil - Add all automation test results to the the Issues log
515214,UNBO-3147,Looping videos in news articles aren't rendering
515128,UNBO-3146,"Change json object title from ""publications"" to ""publicationsCorporate"""
515103,UNBO-3145,Migrate ARM templates from JSON to Terraform
515075,UNBO-3144,Remove WIOP Ireland from json and add redirects tests instead for Corp and WIOP Ireland
515070,UNBO-3143,Redirect corporate and WIOP IE sites to their UK equivalent  
514909,UNBO-3142,Pagination usability issue
514850,UNBO-3141,Moved duplicate Astro components to shared package
514842,UNBO-3140,Percy comparison of www.unilever.com -> deploy-preview-2679--uol-dev.netlify.app
514769,UNBO-3139,UOL: YouTube
514768,UNBO-3138,UOL: Video
514767,UNBO-3137,UOL: Uploader
514766,UNBO-3136,UOL: TowerCard
514765,UNBO-3135,UOL: TitleBanner
514764,UNBO-3134,UOL: TimelineCard
514763,UNBO-3133,UOL: Timeline
514762,UNBO-3132,UOL: Table
514760,UNBO-3131,UOL: Swimlane
514759,UNBO-3130,UOL: StatRow
514758,UNBO-3129,UOL: Notification
514757,UNBO-3128,UOL: Modal
514756,UNBO-3127,UOL: MediaBanner
514755,UNBO-3126,"UOL: LinkList, ListicleItem, Section, Signpost"
514754,UNBO-3125,UOL: HeroSection
514753,UNBO-3124,"UOL: FormCheckbox, FormFile, FormInput, FormSelect"
514752,UNBO-3123,UOL: Feature
514751,UNBO-3122,UOL: Error
514750,UNBO-3121,UOL: Disclaimer
514749,UNBO-3120,UOL: Collection
514748,UNBO-3119,UOL: CalloutCard
514747,UNBO-3118,UOL: BadgeList
514746,UNBO-3117,UOL: AdvancedAccordion
514735,UNBO-3116,Migrate Terraform State file from AWS to Azure
514532,UNBO-3115,Sprint 46 automation tasks
514527,UNBO-3114,Add unilever-caribbean.com into Akamai configuration 
514526,UNBO-3113,Add unilever-caribbean.com to Google search console 
514525,UNBO-3112,Set up Health monitoring - (New Relic - synthetic) for unilever-caribbean.com 
514524,UNBO-3111,CLONE - Site check
514523,UNBO-3110,Set up and test GA4 configuration for unilever-caribbean.com
514522,UNBO-3109,Set up SSL in Akamai for Unilever caribbean
514521,UNBO-3108,Create default home page for Unilever caribbean site
514520,UNBO-3107,Set up environments (QA and Prod) for  Unilever caribbean:
514519,UNBO-3106,Set up domain up domain name for Unilever caribbean: unilever-caribbean.com
514518,UNBO-3105,unilever-caribbean.com Site set up
514495,UNBO-3104,Review distilled sites results - 2023-11-01
514479,UNBO-3103,DQM flagging homepage as not having an H1
514476,UNBO-3102,Using Terraform script the New Relic synthetic alerts
514474,UNBO-3101,TODOs: Sanity Studio Youtube video embed thumbnail
514473,UNBO-3100,TODOs: hardcoded labels
514472,UNBO-3099,Determine if /testing/cookie-complince tests are obsolete
514465,UNBO-3098, Update the Cypress root custom commands design to fix Typescript issues
514439,UNBO-3097,Remove Mocha package and test if Mochawesome continues to work independently
514419,UNBO-3096,Look at using builds with turborepo
514418,UNBO-3095,Set up private proxy registry
514399,UNBO-3094,Add initial unit test structure for Cypress Node code
514352,UNBO-3093,rss redirect not working for Canada (fr)
514348,UNBO-3092,Update the script to update all the contact us forms in one
514347,UNBO-3091,Centralise the contact us into global documents
514345,UNBO-3090,Audit sites hosted on Netlify
514344,UNBO-3089,Review service monitoring of Azure
514343,UNBO-3088,Reorganise the netlify teams
514342,UNBO-3087,Add New Relic test to validate Russia is not listed in Global Contact form locations
514341,UNBO-3086,Have the ability for the contact form to be dynamically be pulled in so it can be reviewed without content updates
514339,UNBO-3085,Review Netlify cache to determine if it's required
514307,UNBO-3084,Review monitoring of builds in the slack channels
514306,UNBO-3083,Remove Sanity access for Irmak
514294,UNBO-3082,Improve README.md documentation
514292,UNBO-3081,Standardize the way we mock modules in unit tests
514288,UNBO-3080,Implement Typescript Project References
514282,UNBO-3079,Reduce console output and error logging in running unit tests
514278,UNBO-3078,Upgrade to node 20
514275,UNBO-3077,Housekeeping: Additional stories in Storybook
514261,UNBO-3076,Housekeeping: Review unit tests and add more to cover gaps in the coverage
514058,UNBO-3075,Manually increase the New Relic (max 50) alerts policies for Corporate sites
513986,UNBO-3074,Nested section with duplicate backgrounds
513984,UNBO-3073,TODOs: Studio document type filtering
513930,UNBO-3072,Stat Grid CTA's not rendering correctly
513928,UNBO-3071,Base the QA smoke tests conditional on the New Relic enabled state in json
513875,UNBO-3070,Difficulty in Uploading Banner Image to the UK Homepage
513867,UNBO-3069,Request unilever-caribbean.com 
513855,UNBO-3068,Percy baseline production tier 1 and tier 2 sites
513800,UNBO-3067,Investigate how we will create a sign up form for the migrated form on https://www.unileverhealth.co.za/
513790,UNBO-3066,TODOs: Tooltip display logic
513789,UNBO-3065,Tooltip arrow position - Firefox macOS
513726,UNBO-3064,Optimise Cypress custom command scrollIntoViewLastAstroIsland
513725,UNBO-3063,Once live add new sites to New Relic and Automation Test Data Json
513711,UNBO-3062,Ensure video action icons consistent in Percy by force set the â€œplayingâ€ value to true
513659,UNBO-3061,Review previous UNBO stories acceptable criteria format
513645,UNBO-3060,Update Debt Investor chart for Q3 2023
513564,UNBO-3059,Test custom form Azure intergration
513474,UNBO-3058,WIOP is missing the Back to top component
513456,UNBO-3057,Sprint 45 automation tasks
513435,UNBO-3056,There is a space just before the footnotes and they should be next to the text
513311,UNBO-3055,Create UCCL Bangladesh websites and publication 
513300,UNBO-3054,Astro - Stack content has removed all spacing between paragraphâ€™s
513294,UNBO-3053,Astro - Call out card misalignment
513220,UNBO-3052,Links in a sublanguage site are linking to the root language
513201,UNBO-3051,Use new QA Accessibility Hub URL in test data json
513196,UNBO-3050,Percy - allow the video buttons to be shown again
513146,UNBO-3049,New websites to the platform 2023
513130,UNBO-3048,Add into Akamai configuration
513129,UNBO-3047,Add to Google search console 
513128,UNBO-3046,Set up Health monitoring - (New Relic - synthetic) 
513127,UNBO-3045,Site check 
513126,UNBO-3044,Set up and test GA4 configuration
513125,UNBO-3043,Set up SSL in Akamai 
513124,UNBO-3042,Create default home page for site
513123,UNBO-3041,Set up environments (QA and Prod) for Huf
513122,UNBO-3040, Set up domain up domain name for ndonesia english site - www.unilever.co.id/en
513121,UNBO-3039,Indonesia english Site set up
513118,UNBO-3038,Terraform up the New Relic alerts
513104,UNBO-3037,Add partytown to the analytics code
513103,UNBO-3036,Scrolling off screen on modal sibling click
513083,UNBO-3035,Brand language variants don't' link in the Prev / Next links
513079,UNBO-3034,Streamline the contact us process
513078,UNBO-3033,Add into Akamai configuration for Huf
513077,UNBO-3032,Add to Google search console 
513076,UNBO-3031,Huf: Set up Health monitoring - (New Relic - synthetic)
513075,UNBO-3030,Site check
513074,UNBO-3029,Set up and test GA4 configuration
513073,UNBO-3028,Set up SSL in Akamai 
513072,UNBO-3027,Create default home page for site
513071,UNBO-3026,Set up environments (QA and Prod) for Huf
513070,UNBO-3025,Set up domain up domain name for Huf - https://www.huf.co.in/en/
513069,UNBO-3024,Huf Site set up
513055,UNBO-3023,Move configs into own package
513053,UNBO-3022,Move shared cypress code from root into it's own package
513042,UNBO-3021,A/B testing news articles
513039,UNBO-3020,Astro - QA Playbook should not be showing the 'Share this page' component
513033,UNBO-3019,HUL Performance Highlights Unpublishing
513031,UNBO-3018,Broken Links
512788,UNBO-3016,Consider adding scrollInotView inside of dataSelector()
512734,UNBO-3015,Sub site menu is linking back to the main site
512722,UNBO-3014,Look at Astro JWT Authentication
512638,UNBO-3013,Review and update DOR / DOD document
512461,UNBO-3012,Compare number of DQM sites
512460,UNBO-3011,DQM Master ticket
512295,UNBO-3010,Create presentation for metrics for Astro/Sustainability 
512046,UNBO-3009,Automation onboarding and practice
511918,UNBO-3008,refactor news signup to match new Azure patterns
511877,UNBO-3007,Review unilever.co.uk OneTrust
511854,UNBO-3006,Sprint 44 automation tasks
511615,UNBO-3005,Hard-coded English part to be changed into Resource label
511389,UNBO-3004,Skip wiop test for footer
511361,UNBO-3003,Skip to content visually missing on corporate sites
511321,UNBO-3002,Distilled sites monthly test shows that www-netlify.unilever.ru is 'cannot be reached' status
511092,UNBO-3001,Housekeeping TODOs
510957,UNBO-3000,Investigate wiop footer link test failing in CI
510918,UNBO-2999,Automation handover
510917,UNBO-2998,Astro fixes automation
510692,UNBO-2997,Review distilled sites results - 2023-10-01
510680,UNBO-2996,Update Terraform script to exclude localhost object
510423,UNBO-2995,.percy.cjs is used in both corp and web - can it be inherited?
510418,UNBO-2994,Investigate Astro Percy showing open modal without a user interaction
510311,UNBO-2993,Give Anthony Access to Calibre
510310,UNBO-2992,Fine tune Calibre app configuration to use for Astro go live (before & after stats)
510163,UNBO-2991,Add custom command for Astro modules to safely lazy load before Percy
510159,UNBO-2990,Create an Azure function to test the page weight
510106,UNBO-2989,TEMPLATE STORY
510104,UNBO-2988,TEMPLATE EPIC
510050,UNBO-2987,Sanity Access request
509698,UNBO-2986,Review for automation - (Astro) Length not matching with highcharts
509220,UNBO-2985,PoC - Configure calibre API with GitHub PR checks
509134,UNBO-2984,Validation of Promoted content is incorrect
509127,UNBO-2983,Sprint 43 automation tasks
509098,UNBO-2982,"""Exclude from feed"" tag is not removing articles from Latest News Feed "
508984,UNBO-2981,Improve TS in cypress.config files
508951,UNBO-2980,Create e2eAuthStore function for automation CMS authentication
508888,UNBO-2979,Investigate remote caching without Vercel
508885,UNBO-2978,Introduce TurboRepo to MonoRepo
508884,UNBO-2977,Replace Yarn with PNPM
508719,UNBO-2976,If a WIOP product name starts with a number it will not return anything
508679,UNBO-2975,Brand LYNX is also displaying Alberto Balsam product
508537,UNBO-2974,Duplicate search results
508519,UNBO-2973,"WIOP QA Issues | Ingredients are showing ""No Glossary"" for the Brand Product"
508487,UNBO-2972,images not appearing in press / news emails
508472,UNBO-2971,Azure Migration - Custom Form Endpoint
508469,UNBO-2970,Playbook: Create page for Footer Accreditations
508434,UNBO-2969,Reduce TS eslint-disable in automation files
508081,UNBO-2968,CLONE - Internal links and images broken on standards pages
508066,UNBO-2967,Removal of tea brands off the Canada contact us sites
508040,UNBO-2966,Investigate security attack methods on UOL forms
508035,UNBO-2965,Script to extract brands list from the contacts us form in prep for brand removal
507959,UNBO-2964,Review for automation - publish sanity
507939,UNBO-2963,Review for automation - Footer Accreditation logo
507887,UNBO-2962,Call WIOP Synchronously 
507837,UNBO-2961,HUL  - Remove Brand Filters 
507810,UNBO-2960,Review for automation - qa failures
507608,UNBO-2959,Configure New Relic post data for CMS UI tests
507599,UNBO-2958,Redesign tower promo test page
507401,UNBO-2957,Contact Form Issue
507395,UNBO-2956,Contact us form E - Mail does not allow .co.uk addresses
507300,UNBO-2955,Slow Sanity Studio
507195,UNBO-2954,Fix TS issue with /fixtures/uol-domains-test-data.json import
507148,UNBO-2953,Update logic of WIOP cache for Product 204's
507142,UNBO-2952,Audit on visuality case studies
507140,UNBO-2951,Migrate Cypress root level custom commands to new TS design
507099,UNBO-2950,Review for automation - Streamline content workflow
507055,UNBO-2949,Astro serach indexing
506932,UNBO-2948,PDF 
506931,UNBO-2947,Enable deep-linking into a specific page of a PDF
506930,UNBO-2946,Enable large PDF URLs to be the same as a small PDF URL
506929,UNBO-2945,Review the File URL structure
506912,UNBO-2944,The resource page in SEAC Stage is timing out 
506845,UNBO-2943,Sprint 42 automation tasks
506494,UNBO-2942,Create Playbook page for Profile Pages
506468,UNBO-2941,Custom command statusCodeAllSites requires redesign for dynamic password in cy.authApi
506420,UNBO-2940,Remove order field from schema 
506415,UNBO-2939,experimentalWebKitSupport=true can be reverted to false
506413,UNBO-2938,svg's not visible in light mode 
506230,UNBO-2937,Update to use astro-netlify add-on rather than custom functions
506229,UNBO-2936,Convert build scripts â€œsrc/scriptsâ€ into astro integrations
506227,UNBO-2935,Add astro serializers for every module
506226,UNBO-2934,Create astro Block Content component switcher
506225,UNBO-2933,Use Astro SEO plugin
506224,UNBO-2932,Tweak returned payload to better suit Astro pages
506223,UNBO-2931,Move â€˜Pagesâ€™ components in â€˜Viewsâ€™ and convert to .astro files 
506222,UNBO-2930,Convert main default renderer and LayoutBase into a single astro layout
506221,UNBO-2929,Update project to handle .astro files for listing and formatting
506220,UNBO-2928,Add Astro + Astro vue
506219,UNBO-2927,Remove Vite plugin SSR
506200,UNBO-2926,Fix timeline nav automation pages with images
506136,UNBO-2925,Update sitemap for WIOP non functional test
506135,UNBO-2924,Baseline Percy for migration
506131,UNBO-2923,Add the ability to load a track file to videos
506046,UNBO-2922,Create test plan for Astro workstream
505967,UNBO-2921,leadership profile has the same person as next
505763,UNBO-2920,Investigate the need to reorder the setCookie OT for wiop qa Percy run
505758,UNBO-2919,Add in redirects
505667,UNBO-2918,Review distilled sites results - 2023-09-01
505650,UNBO-2917,Add wiop QA smoke test for themeTooltipLabel
505459,UNBO-2916,Implement session caching for CMS UI tests
505432,UNBO-2915,Include footer communication in test data json
505413,UNBO-2914,Enable tooltip for header theme in WIOP
505402,UNBO-2913,WIOP brand image is not showing on products page
505390,UNBO-2912,the WIOP language selector is incorrectly directing to wiop.unilever.si
505388,UNBO-2911,Add logging for WIOP to identify zero products / ingredients
505356,UNBO-2910,Upgrade cypress to v13.0.0
505271,UNBO-2909,P2 - News article email alert error
505213,UNBO-2908,Create Azure QA and Production accounts
504891,UNBO-2907,Astro hydration - Search indexing: solution discussion
504890,UNBO-2906,Astro hydration - Analytics
504889,UNBO-2905,Astro hydration - Main Integration
504861,UNBO-2904,Playbook: profilePromo
504754,UNBO-2903,Implement sustainability article 
504753,UNBO-2902,Implement Sustainability Notice for unilever.com
504752,UNBO-2901,Sustainable IT 2023
504748,UNBO-2900,Test the backup restore
504746,UNBO-2899,Store Sanity backup in Azure blob storage
504745,UNBO-2898,Create backup function that exports the sanity Dataset
504697,UNBO-2897,Update Gigya News Feed Endpoint
504690,UNBO-2896,Sprint 41 automation tasks
504490,UNBO-2895,Improve Honeypot captcha
504465,UNBO-2894,News feed - Themes aren't being recognised
504455,UNBO-2893,Fix int UI tests for news topic banner
504448,UNBO-2892,Update QA preview site in Verify preview sites test
504445,UNBO-2891,Update test data with new Playbook URLs
504444,UNBO-2890,Replace everywhere automation publication with https://qa-automation-netlify.unileveronline.com
504443,UNBO-2889,profilePagePromo validation/handling needed for when a page does not have a profileBlock
504319,UNBO-2888,The ingredients in WIOP seem to be hard coded
504232,UNBO-2887,HIVE - GTM Update 
504124,UNBO-2886,Create initial Azure framework 
504116,UNBO-2885,Playbook: Update NewsFeed documentation to reflect latest changes
504046,UNBO-2884,"Translations - Investigate whats best in class (Sanity AI assist, context surrounding)"
504030,UNBO-2883,WIOP QA issues
504017,UNBO-2882,Timeline Banner/Tower Promo reference assetImage as a field type rather than as a reference-to type
504003,UNBO-2881,Review for automation - brands failure
504001,UNBO-2880,Get a list of brands that have no Logos in sanity
503991,UNBO-2879,The Best Bets field is being queried when using the main search. Should it?
503774,UNBO-2878,Remove uol-qa-testautomation.netlify.app from framework
503757,UNBO-2877,Test the cache data for WIOP
503756,UNBO-2876,Add the WIOP brand page ping test on the build
503754,UNBO-2875,Create new domains for the QA sites
503733,UNBO-2874,wiop .com to hide breadcrumbs
503716,UNBO-2873,AWS migration - Campaign form (IR/ICNOW)
503715,UNBO-2872,AWS migration - Email sign up service (News sign up)
503714,UNBO-2871,AWS migration - Sanity CMS backup
503713,UNBO-2870,AWS Migration
503711,UNBO-2869,Draft clean up task 
503508,UNBO-2868,Slugs not updating properly on the accessibility hub
503448,UNBO-2867,Move Netlify plugin ping test to allow all packages use it
503428,UNBO-2866,Remove storybook.yml as its obsolete
503325,UNBO-2865,cms wiop and standards promoList:object undefined:reference
503275,UNBO-2864,Review for automation - wiop qa failures
503160,UNBO-2863,Add NR tests for WIOP Brands page
502974,UNBO-2862,Review for automation - WIOP QA smoke test
502973,UNBO-2861,Form fields validation highlighting
502972,UNBO-2860,Review AWS policy for billing in production as it needs upgrading. 
502963,UNBO-2859,"wiop IE does not store the OT cookie, so the banner keeps appearing."
502962,UNBO-2858,wiop - some publications are 404 on brands page and missing fragrance search in allergies
502961,UNBO-2857,Minimal footer cuts the high five off
502924,UNBO-2856,News Article Header missing
502902,UNBO-2855,Check the cleanup in WIOP to ensure it handles issues with the WIOP feed
502860,UNBO-2854,"When using Hide env vars Playbook is still showing ""Connect with us"""
502854,UNBO-2853,The news section on staging is now throwing 301's
502832,UNBO-2852,WIOP about allergies is missing the fragrance search component 
502831,UNBO-2851,Additional analytics for 'enter' button
502689,UNBO-2850,Look at QA WIOP sites that need some TLC
502665,UNBO-2849,Add New Relic for WIOP pre prod sites
502662,UNBO-2848,Adjust alignment of country listing on location selector
502661,UNBO-2847,Evaluate GitHub CodeQL and SonarQube
502657,UNBO-2846,wiop - OT cookie settings button is blocking the browser Theme button
502638,UNBO-2845,Re implement WIOP schedule
502635,UNBO-2844,BAU
502604,UNBO-2843,Sprint 40 automation tasks
502519,UNBO-2842,wiop Switzerland - brands total count is changing once interacting with pagination
502515,UNBO-2841,wiop Greece - ingredients-glossary is repeating letters in glossary
502513,UNBO-2839,wiop - your-ingredient-questions-answered pages returning 404 error
502511,UNBO-2838,"wiop - brands missing images, suggest using default Unilever image"
502506,UNBO-2837,wiop - brands pages returning 404 error
502502,UNBO-2836,Adding brand page to main menu results in Untitled & Invisible link
502472,UNBO-2835,Review for automation - Update JSON for WIOP sites
502471,UNBO-2834,Review for automation - Update Json for Bangladesh
502378,UNBO-2833,Create a new wiop.unilever.com site
502322,UNBO-2832,Look at hoisting Cookie Management component to shared. 
502321,UNBO-2831,Reported timeouts in Sanity
502285,UNBO-2830,Brand products showing 404 
502278,UNBO-2829,Wiop sub sites have no brand listing pages
502256,UNBO-2828,Stage - Estonia showing the live URLs
502255,UNBO-2827,There is no cookie blocker infrastructure in WIOP
502254,UNBO-2826,Enable the standards referenced to be search in a list and filter on the accessibility hub
502253,UNBO-2825,Stage - Brands page 500 error
502252,UNBO-2824,Stage - Glossary has no data
502224,UNBO-2823,Streamline content workflow
502125,UNBO-2822,In the new unilever-online brand listing some of the logos are different
502084,UNBO-2821,Dark mode: logo icons not displayed correctly
502075,UNBO-2820,Review for automation - Update Prod non-functional sites
501968,UNBO-2819,Transfer or New DNS
501931,UNBO-2818,Review for automation - ingredients glossary
501930,UNBO-2817,Review for automation - Brands
501907,UNBO-2816,Review for automation - qa failures
501877,UNBO-2815,regenerate is missing in en-gb for WIOP
501851,UNBO-2814,Find a solution to redirect wiop contact us page U.com/contact/
501849,UNBO-2813,WIOP Search for fragrance allergens incorrect conditional 
501638,UNBO-2812,Amend queries to bring back raw Documents and perform subqueries in processor layer
501587,UNBO-2811,Review for automation - Accordion 
501414,UNBO-2810,Review for automation - header theme
501173,UNBO-2809,Page Hydration
501116,UNBO-2808,News landing page - Change image ratio from 1:1 to 16:9
501114,UNBO-2807,Review template tests for possible removal
501084,UNBO-2806,News feed - add fields to manage tags and date on/off 
501060,UNBO-2805,Add CI triggers for /shared code changes
501055,UNBO-2804,Review for automation WIOP -  Card
500908,UNBO-2803,Update theme for WIOP header theme 
500883,UNBO-2802,WIOP Search products fails in CI
500852,UNBO-2801,Accessibility Hub and .com sitemap broken
500851,UNBO-2800,Date range search filters excluding articles and PRs dated 31st
500749,UNBO-2799,Review distilled sites results - 2023-08-01
500736,UNBO-2798,Add translatable new labels
500713,UNBO-2797,Map fragrance note to FE from WIOP cache service
500634,UNBO-2796,Add a WIOP browser theme test
500486,UNBO-2795,Updated QA smoke tests to matched prod content changes
500485,UNBO-2794,Sprint 39 automation tasks
500445,UNBO-2793,Update int search tests after filter number count change
500432,UNBO-2792,Contact enhancements - Error Handling iOS
500431,UNBO-2791,Issue creating a new hierarchy link under menu navigation
500430,UNBO-2790,Add new label translations
500427,UNBO-2789,Contact enhancements - Error Handling
500424,UNBO-2788,update Vite plugin SSR to new naming conventions 
500420,UNBO-2787,Footer Accreditation logo
500403,UNBO-2786,News feed driven by tag or topic - showing draft articles
500250,UNBO-2785,Revisit skipped footnotes tests
500239,UNBO-2784,Use CI branches-ignore to block tests running on release to Main
500222,UNBO-2783,Media strip image hot-spot is being ignored
499953,UNBO-2782,Remove the total numbering from the filters in the search and all list and filters across the platform
499929,UNBO-2781,AWS vulnerability - External web identity with high privileges
499928,UNBO-2780,AWS vulnerability - Service account with excessive admin permissions is assigned to a resource
499866,UNBO-2779,Charts - data table in dark mode
499865,UNBO-2778,Remove Download XLS option on the charts
499850,UNBO-2777,Review distilled sites results - 2023-07-26
