id,key,summary
546928,UNBO-4080,Review custom command code auth cms
546915,UNBO-4079,Secure Netlify Origin
546914,UNBO-4078,WHAM - 2024
546865,UNBO-4077,Make use of vitest workspaces over a separate file per package
546804,UNBO-4076,Investis feeds blocked if cookies aren't accepted
546748,UNBO-4075,QA metrics - write python script to fetch all Jira issues
546664,UNBO-4074,WIOP Brand Page does not allow any sorting/pagination
546645,UNBO-4072,enhance sitemap to add last modified date
546630,UNBO-4071,Update contact us form to remove Elida
546580,UNBO-4070,DORA meteics - Jira to excel data load task needs to configured via ci workflow
545854,UNBO-4069,Investigate ci workflow axe linter failing
545606,UNBO-4068,Move WHAM service from terraform to Pulumi
545595,UNBO-4067,Provide Sanity Access
545571,UNBO-4066,Update CMDB with the decommissioned Korea english site
545570,UNBO-4065,Update the monitoring to remove the Korea english site
545569,UNBO-4064,Remove korea english domain from the DNS
545568,UNBO-4063,Remove Korea English site from Netlify
545567,UNBO-4062,Add redirect to Akamai to redirect Korean english to Korean site  
545458,UNBO-4061,Content Syndication: Implementing tracking of global articles shared with markets
545420,UNBO-4059,Provide the ability to remove passwords from the login
545287,UNBO-4058,Create SSO integration for all Dev and QA sites on UOL platform
545283,UNBO-4057,Redesign resolve-percy-tokens.ts to ensure no need to hardcode PUBLICATION_UNDER_TEST keys
545148,UNBO-4056,Enable Nepal as Brands = true in test data json
545145,UNBO-4055,Create Percy comparisons for Open Search vs Azure - Language = English
545143,UNBO-4054,ADR_20255-8: Unordered list not marked up semantically
545142,UNBO-4053,ADR_20255-34: Multiple page regions without accessible name
545140,UNBO-4052,ADR_20255-28: Current in-page link is not programmatically identified
545139,UNBO-4051,ADR_20255-16: Interactive elements with no accessible name
545138,UNBO-4050,ADR_20255-14: Incorrect use of aria-haspopup on expandable element
545137,UNBO-4049,ADR_20255-13 Missing or malformed ARIA on select-only combobox
545135,UNBO-4048,ADR_20255-10: Current page is not programmatically identified
545133,UNBO-4047,ADR_20255-25: Focused element is completely hidden by author-created content
545108,UNBO-4046,ADR_20255-24: Non-interactive elements receive keyboard focus
545107,UNBO-4045,ADR_20255-12: Focus does not remain on activated element when using a screen reader
545106,UNBO-4044,ADR_20255-27: Same page link does not move focus when activated
545105,UNBO-4043,ADR_20255-4: Content is not hoverable
545102,UNBO-4042,ADR_20255-3: Content triggered by mouse hover or keyboard focus is not dismissable
545101,UNBO-4041,Provide Sanity access
545100,UNBO-4040,ADR_20255-22: Text spacing is not fully supported
545099,UNBO-4039,ADR_20255-32: Interactive element fails contrast when receiving mouse hover
545097,UNBO-4037,ADR_20255-31: Informative non-text content fails contrast
545096,UNBO-4036,ADR_20255-29: Custom focus indication fails contrast
545095,UNBO-4035,WIOP brand products show when the brand is not present
545093,UNBO-4034,ADR_20255-37: Reflow causes loss of content and functionality
545083,UNBO-4028,ADR_20255-1: Reflow causes loss of content
545082,UNBO-4027,ADR_20255-36: Zoom causes loss of meaningful content and functionality
545075,UNBO-4026,ADR_20255-2: Colour relied upon to communicate information
544957,UNBO-4020,Palm Oil small screen size shows map as transparent when a feature-content scroll past
544902,UNBO-4019,Decommission Korea English language website
544811,UNBO-4018,Accessibility - Ensure elements that have scrollable content are accessible by keyboard
544809,UNBO-4017,Accessibility - Ensures the contrast between foreground and background colors meets WCAG 2 AA minimum contrast ratio thresholds Help
544807,UNBO-4016,Accessibility - Ensures links have discernible text
544800,UNBO-4015,Accessibility - Ensures aria-hidden elements are not focusable nor contain focusable elements
544796,UNBO-4014,Dora metrics - add values for all 'Ready for release date' since 1st Jan
544787,UNBO-4013,Create confluence page for Azure search test terms
544772,UNBO-4012,Roll out OneTrust in https://www.unilever.com.bd
544759,UNBO-4005,ADR_20255-15: Instructions rely on visual sensory characteristics
544757,UNBO-4004,ADR_20255-20: Reading order includes off-screen elements
544755,UNBO-4003,ADR_20255-18: Content inappropriately hidden which breaks reading order
544753,UNBO-4002,ADR_20255-7: Background elements can be accessed with a screen reader
544751,UNBO-4001,ADR_20255-23: Heading structure is inconsistent with the visual structure
544750,UNBO-4000,ADR_20255-19: Radio group not associated with legend
544743,UNBO-3999,ADR_20255-26: Decorative image has redundant text alternative (Palm story)
544729,UNBO-3998,ADR_20255-21: Map images have inappropriate text alternative
544643,UNBO-3997,ADR_20255-17: Decorative image has redundant text alternative 
544639,UNBO-3996,ADR_20255-9: Decorative image has redundant text alternative
544635,UNBO-3995,AbilityNet: Navigation and deforestation
544617,UNBO-3994,test raising a bug
544616,UNBO-3993,ADR_20255-33: Keyboard focus is trapped
544343,UNBO-3991,Upgrade the version of opensearch
544328,UNBO-3990,The AWS deploy actions are failing a deploy
544172,UNBO-3989,Rollout Onetrust on https://accessibilityhub.unilever.com
544171,UNBO-3988,Rollout Onetrust on https://playbook.unilever.com
544170,UNBO-3987,Rollout Onetrust on https://www.unileverconsumercarebd.com
544169,UNBO-3986,Rollout Onetrust on http://unileverconsumercarebd.com/bn
544168,UNBO-3985,Rollout Onetrust on https://www.unilevermaghreb.com
544167,UNBO-3984,Rollout Onetrust on https://www.unilever.co.kr
544166,UNBO-3983,Rollout Onetrust on https://www.unilever.com.lk
544165,UNBO-3982,Rollout Onetrust on https://www.unilever.com.sg
544164,UNBO-3981,Rollout Onetrust on https://www.unilever.com.au
544163,UNBO-3980,Rollout Onetrust on https://www.unilever.com.ph
544162,UNBO-3979,Rollout Onetrust on https://www.unilever-southlatam.com
544161,UNBO-3978,Rollout Onetrust on https://www.unilever-northlatam.com
544160,UNBO-3977,Rollout Onetrust on https://www.unilever.com.cn
544159,UNBO-3976,Rollout Onetrust on https://www.unilever.co.il
544158,UNBO-3975,Rollout Onetrust on https://www.unilever.pk
544157,UNBO-3974,Rollout Onetrust on https://www.unilever-ewa.com
544156,UNBO-3973,Rollout Onetrust on https://www.unilever.ca
544155,UNBO-3972,Rollout Onetrust on https://www.unilever.ca/fr
544154,UNBO-3971,Rollout Onetrust on https://www.unilever-caribbean.com/
544153,UNBO-3970,Rollout Onetrust on https://www.unilevernepal.com
544057,UNBO-3969,Investis feeds aren't working for some users
543946,UNBO-3968,Twitter Icon in brand profiles
543899,UNBO-3967,Investigate the downtime of www.unilever.com.tr
543873,UNBO-3966,Update Navigation metric slide + investigate negative change in metrics
543828,UNBO-3965,wiop.unilever.com cookies dropping
543821,UNBO-3964,Add new relic coverage for adchoice and cookie q banners
543815,UNBO-3963,Possible to reduce duplication in pre prod smoke tests for Contact US (UK & U.com)
543802,UNBO-3962,Update the monitoring to remove the Kazakh site
543801,UNBO-3961,Update CMDB with the decommissioned Kazakh site
543800,UNBO-3960,Remove domains from the DNS
543799,UNBO-3959,Remove both Kazakh sites from Netlify
543798,UNBO-3958,Add redirect to Akamai to redirect Kazakhstan to Unilever.com
543781,UNBO-3957,For unilever-com-wiop fix auth of QA and Stage sites
543663,UNBO-3956,Review Pulumi instead of Terraform
543567,UNBO-3955,Axe POC - Wire up Dev Hubs 'Axe Watcher' to uol automation framework
543543,UNBO-3954,Review distilled sites results - 2024-06-01
543521,UNBO-3953,Review Panel items link test
543332,UNBO-3952,Enable Akamai logging for all sites
543331,UNBO-3951,Enable Netlify logs
543308,UNBO-3950,Disable Sanity Backup
543190,UNBO-3949,NFR: Verify / demonstrate that Non -functional requirements are captured for all user stories at platform level
543189,UNBO-3948,NFR:  Review and Finalise NFRs (Consumer Based Websites)
543188,UNBO-3947,NFT: Early performance 'Accessibility testingï¿½  POC and building NFT capability
543187,UNBO-3946,NFT:  Early performance Testing POC and building NFT capability
543186,UNBO-3945,NFT:  Accessibility: AXE integration with Automation Pipeline
543185,UNBO-3944,Automation:   BrowserStack integration for compatibility testing
543184,UNBO-3943,Automation: Test Management Tool Integration with automation framework and updating the results back to Jira Zephyr Scale
543183,UNBO-3942,"Go-Live / Release Ticket: Ensure Functional, Non-Functional and UAT TCR and signoff are linked to go-live ticket"
543182,UNBO-3941,Test Case Mapping Ensure Zephyr testcases are mapped to Jira stories so test traceability reports can be generated automatically and Jira test coverage ï¿½Realtimeï¿½ dashboards.
543181,UNBO-3940,Regression- explore the challenge on regression defects created. Are there ways to mitigate this impact?
543180,UNBO-3939,"Integration Testing - map out the current integration points and approaches (i.e. API, file exchange or none)"
543179,UNBO-3938,"Baseline Metrics ï¿½ establish meaningful metrics to assess quality, efficiency or agility inline with Master Test Strategy"
543178,UNBO-3937,Sprint Retro - Reinstate Sprint retrospective meeting
543177,UNBO-3936,Epic and Stories Creation - Ensure that Epics and Stories are created in the recommended template Epic Writing Story Writing
543176,UNBO-3935,Bug Workflow - Verify the Bug workflow and the mandatory fields and work with QA lead to ensure defects traceability are in place
543175,UNBO-3934,Acceptance Criteria:  Ensure Acceptance are created by BA in BDD format for all the stories
543174,UNBO-3933,Defect RCA:  Perform Qualitative RCA from the current Sprint onwards and capture the outcome in ï¿½Sprint Retrospectiveï¿½ Report
543173,UNBO-3932,Test Closure report (TCR): Create Test Closure Reports from Current Release
543172,UNBO-3931,Jira Standardisation: Implement Standardised Workflows and Field configurations
543171,UNBO-3930,Peer Review -  Test Scenarios needs to be reviewed by BA
543170,UNBO-3929,"DoR and DoD - Ensure that DoR and DoD is followed for Epics,  stories, Tasks and Bugs including QA readiness and Closure."
543169,UNBO-3928,Unit Test Results/Reports: Demonstrate that Unit test results are shared with QA and both happy and unhappy paths are covered.
543168,UNBO-3927,Test Data Management - Ensure that the test data approach is documented during the test planning phase adhering to the Test Data Management (CID) compliance guidelines documented in MTS
543167,UNBO-3926,"Sprint Goal / Scope- Ensure that sprint goal, scope of components / work are agreed for every sprint and the process is followed continuously"
543166,UNBO-3925,Zephyr Test Plan - Implement Zephyr Test plan for every release. Currently the team has a common test plan documented that is referred for all releases.
543165,UNBO-3924,Jira Hygiene Dashboard  - Fix all the Jira data issues reported from current sprint onwards
543164,UNBO-3923,Jira Hygiene Dashboard  - Create and publish Jira Hygiene dashboard
543163,UNBO-3922,To-Be Test Process - document the ï¿½To Beï¿½ test process inline with the 'E2E QA Approach that adopts shift left methodology ' with the agreed process tweaks and changes
543162,UNBO-3921,As-Is Test Process - document the current test process within the Unilever Online  within a confluence page.
542977,UNBO-3920,Update cookie-notice legal test for US region
542976,UNBO-3919,Add custom test for broken external links
542974,UNBO-3918,Update the contact us forms
542972,UNBO-3917,Investigate a consumption plan with Azure and Linux
542970,UNBO-3916,Investigate uploading the function code with terraform
542969,UNBO-3915,Review Azure service role
542868,UNBO-3914,Search - Analytics 
542867,UNBO-3913,Search - Index Languages per site
542866,UNBO-3912,Implement Search as is 
542864,UNBO-3910,add link cloud module into Playbook
542859,UNBO-3909,Text of Title and Body field in Hero Section Module is not wrapped within the box.
542857,UNBO-3908," #AHR0024: ""On this page"" quick links on standards pages"
542818,UNBO-3907,Investigate Akamai CDN and WAF set up
542817,UNBO-3906,Axe POC - Prepare slides with DQM vs Axe Monitor stats
542810,UNBO-3905,Invalid preview config | CMS Sanity
542718,UNBO-3903,"Security issue - Cookie Does Not Contain The ""HTTPOnly"" Attribute"
542717,UNBO-3902,"Security issue - Cookie Does Not Contain The ""secure"" Attribute"
542716,UNBO-3901,Security issue - Predictable Resource Location Via Forced Browsing
542715,UNBO-3900,Security issue - open redirect
542714,UNBO-3899,Security issue - open redirect
542713,UNBO-3898,Security issue - open redirect
542710,UNBO-3896,Test WIOP WAF onboarding
542697,UNBO-3895,Closure of Unilever Kazakhstan websites
542675,UNBO-3894,Userway test site
542313,UNBO-3893,Feature - first image is lazy loaded when first item in body
542305,UNBO-3892,Create an API to retrieve the data fro WHAM
542304,UNBO-3891,Create lighthouse data pull and summary
542131,UNBO-3890,Remove OneTrust AutoBlocking from the site
542104,UNBO-3889,Row block wrapping oddly
542091,UNBO-3888,Create url for Notices CMS (cms-notices)
542090,UNBO-3887,Content of a case study (within a section) is showing as white on white
542061,UNBO-3885,Add download module to the playbook callout section
542058,UNBO-3884,Automation coverage of Front End package notices
542056,UNBO-3883,Automation coverage for CMS Notices
541891,UNBO-3882,Feature group first image is lazy loaded
541879,UNBO-3881,"Set up Dev, Qa, and Production"
541813,UNBO-3880,Unilever Online QAF Implementation Tasks
541781,UNBO-3879,The Press release link on sub site news doesn't link correctly
541771,UNBO-3878,Axe POC - axe cli post results to axe reports
541768,UNBO-3877,High charts Maps POC
541767,UNBO-3876,AXE POC - Configure Rest API's to extract Axe Monitor data
541755,UNBO-3875,Create CMS guide in playbook for creating a Brand
541453,UNBO-3874,Storybook does not have SSO showing even though it's enabled
541345,UNBO-3872,Resturcture of the UNOP confluence
541231,UNBO-3871,Update WIOP link to USA
541168,UNBO-3870,Review for Automation - Create a Drafts custom page
541166,UNBO-3869,Korea sites (ko-KR and en-GB) are still using /planet-and-society/
541164,UNBO-3868,DACH QA is not matching DACH Prod for redirect /planet-and-society/ /sustainability/
541131,UNBO-3867,Produce technical document for search solution in confluence 
541114,UNBO-3866,Analytics for search 
541113,UNBO-3865,Testing strategy for search 
541112,UNBO-3864,Load testing 
541103,UNBO-3863,Search Phase 2
541077,UNBO-3862,Investigate and reduce Azure costs
541016,UNBO-3861,Standardise display options on schemas
541009,UNBO-3860,Problem publishing images
540843,UNBO-3856,Sanity Content Helpers Showing Incorrect number of Publications
540789,UNBO-3855,Improve List and filters on the platform
540784,UNBO-3854,"Feature group ""jumps"" on load"
540744,UNBO-3853,It seems the fragrance data for WIOP is no longer showing.
540734,UNBO-3851,Sanity is not able to retrieve details unpublished pages under Test Manual Publications.
540733,UNBO-3850,Broken Sitemap Links â€“ Be/Fr & Ca/Fr
540730,UNBO-3849,Wham â€“ Accessibility & Non-Accessibility Tests
540725,UNBO-3848,Accessibility WCAG 2.2 Level AA - Ensure touch target have sufficient size and space
540705,UNBO-3847,Axe POC - configure sandbox site with accessibility violations
540604,UNBO-3846,"Issues | Twitter icon is being displayed as ""Bird"" instead of ""X"""
540475,UNBO-3843,create a one pager outlining the options for securing origin
540434,UNBO-3842,Document the generic SSO process
540431,UNBO-3841,Document change password process
540376,UNBO-3840,Lower New Relic threshold for draft documents count
540284,UNBO-3839,Create Notice website
540281,UNBO-3838,Create new Document type / Schemas - Notice
540280,UNBO-3837,Create new Page type / Schemas - Language
540276,UNBO-3836,Create new Sanity Studio for Notices
540260,UNBO-3835,ThemeSwitcher Tooltip - arrow in wrong position
540224,UNBO-3834,Sanity Content Helper - results page isn't scrollable
540164,UNBO-3833,Provide Sanity access
540025,UNBO-3832,New studio - helpers don't scroll
539954,UNBO-3831,publications are missing in WIOP
539882,UNBO-3830,Redesign ci workflow studio cms for running qa publications
539818,UNBO-3829,Onetrust cookie notice link is missing
539817,UNBO-3828,Onetrust cookie banner is missing
539812,UNBO-3827,Onetrust JS missing OtAutoBlock.js or otSDKStub.js 
539811,UNBO-3826,onetrust automation cookie and privacy notice Link mismatch in page footer
539810,UNBO-3825,Onetrust cookie notice link mismatch
539808,UNBO-3824,Privacy and Cookie Notice language versions not availble
539775,UNBO-3823,Axe POC - Script an authenticated login to scan Stage publication
539747,UNBO-3822,Show the Read time and categories in the Promos
539746,UNBO-3821,Ability to use the Topics layout to create a list of links (link cloud module)
539742,UNBO-3820,Add hero section to front page
539736,UNBO-3819,Change Slack channel name - uol-new-relic-monitoring
539612,UNBO-3818,Bot traffic issue 
539609,UNBO-3816,Review Abilitynet report for deforestation and Navigation
539607,UNBO-3815,Create POC for Notice site 
539570,UNBO-3814,The image routing is not longer going though Akamai
539539,UNBO-3813,Write migration to remove all asset images that have no references
539482,UNBO-3812,Axe POC - Integrate package axe-devtools/cypress
539419,UNBO-3811,The standards CSV file seems to be duplicating
539345,UNBO-3809,Add stat variant
539332,UNBO-3808,Cleanup publications from QA with recursive delete
539327,UNBO-3807,Review security issue with PDF.js
539219,UNBO-3806,Add brand theme into section 
539172,UNBO-3805,Markets - Avg. page load time
539147,UNBO-3804,Remove legacy Navigation code
539103,UNBO-3803,Check how the links to an archived Press render
538681,UNBO-3802,Set up Slack failure notifications for Axe Linking workflow
538592,UNBO-3801,Front Pages missing Feature Group
538483,UNBO-3800,No message displayed when JS is disabled
538452,UNBO-3799,Review automation test data json for enabled OneTrust sites
538379,UNBO-3798,Feature Module | Colors are not changing when mouse is hovered over the tabs.
538344,UNBO-3797,Create New Relic test for checking GA events meet a certain threshold of visitors
538339,UNBO-3796,Events are not firing due to partytown being re-enabled
538174,UNBO-3794,Add ci workflow for Axe Linter
538167,UNBO-3793,Refactor out axios for using the fetch API instead
538161,UNBO-3792,Onetrust Broken - Unilever.fi
538148,UNBO-3790,Redesign notice site 
538147,UNBO-3789,Sanity studio update 
538146,UNBO-3788,Sanity phase 1 - 2024
538120,UNBO-3787,Review distilled sites results - 2024-05-01
538084,UNBO-3786,The media strip in a RTL site doesn't seem to show the image
538056,UNBO-3785,List the languages alphabetically
538054,UNBO-3784,Create a Drafts custom page
538051,UNBO-3783,Be able to copy array items 
538050,UNBO-3782,Brand page sort by title does not work 
538048,UNBO-3781,Brand page sort by title does not work 
537943,UNBO-3780,Document the redirect process for the Editorial redirects
537935,UNBO-3779,Add in a dependency update script
537929,UNBO-3778,Add in TurboRepo
537928,UNBO-3777,Integrate SonarQube
537927,UNBO-3776,Run unit tests on push
537926,UNBO-3775,Add TypeScript linting
537925,UNBO-3774,Create comment linting on commit
537923,UNBO-3773,Create Insights in the WHAM! repository
537872,UNBO-3772,Review for Automation - Feature group module
537871,UNBO-3771,Review for Automation - Decouple brand profile country tabs from country filter
537870,UNBO-3770,Review for Automation - Add 'open' toggle to accordion items
537868,UNBO-3769,Review for Automation - Read time for accessibility hub
537867,UNBO-3768,Review for Automation - Archiving all news & press articles older than 6 years
537865,UNBO-3767,Download callout Module 
537528,UNBO-3766,Housekeeping: Update Storybook version
537496,UNBO-3765,Remove Russian brand logos from Sanity
537431,UNBO-3764,initial search results counts are incorrect until another search request is made
537153,UNBO-3763,Review unilever-com-percy-test.netlify.app results page is not loading in Percy
537006,UNBO-3761,QA Automation dataset update to use /sustainability/take-action/
536788,UNBO-3760,Document the Page Speed insights tool
536688,UNBO-3759,Add in ITSG reference to all resource groups in Azure
536469,UNBO-3758,Create Architecture documentation and add in search documentation
536430,UNBO-3757,Update Debt Investor highchart - Q1 2024
536327,UNBO-3756,Implement our own version of a Retrieval Augmented Generation input+response
536325,UNBO-3754,Implement additional analytics and behavioural querying
536324,UNBO-3753,Fix sorting on news/press search for when a query is provided
536321,UNBO-3752,Type-ahead search in the homepage search
536320,UNBO-3751,Get list if pages to monitor from the unequepage.xml
536319,UNBO-3750,Add Platform and Brand to the list of Domains to test
536318,UNBO-3749,Make use of multilingual vector search
536317,UNBO-3748,Add unit tests to the Page Speed Insights
536316,UNBO-3747,Add monitoring to the Page Speed Metrics
536314,UNBO-3746,Add monitoring to the Page
536313,UNBO-3745,Investigate analytics API required calculate carbon emissions
536312,UNBO-3744,Add better language fields for the schema
536311,UNBO-3743,Add in website carbon api call
536310,UNBO-3742,Update the IaC to deploy new service
536309,UNBO-3741,Integrate Page Performance tool into CMDB
536306,UNBO-3740,Amend the FE search request generation
536305,UNBO-3739,File indexing and bulk copy process
536304,UNBO-3738,File indexing and bulk copy process
536302,UNBO-3737,Reimplement automatic index creation and ~3 month removal
536298,UNBO-3736,Migrate or remove the API Gateway+Cognito implementation
536297,UNBO-3735,Amend schema to align with new service
536296,UNBO-3734,Search Phase 1 - 2024
536213,UNBO-3733,News feed variant Confluence page needs updating with all available options
536210,UNBO-3732,Agency signup is not working for accesabilityhub
536207,UNBO-3731,"Change ""TakeAction"" Path "
536061,UNBO-3730,Not able to read promos on mouse-over
536047,UNBO-3729,Add ability to remove original document field to prevent inability to delete referenced documents
536045,UNBO-3727,SSO integration with the Accessibility Hub is currently not working
536042,UNBO-3726,Sign up forms throwing 404 errors
535872,UNBO-3725,Review for Automation : Refactor of the Latest News module.
535871,UNBO-3724,Review for Automation : Add a card variant
535780,UNBO-3723,Read time for accessibility hub
535652,UNBO-3722,Look at formatting the file upload for Contact Us
535603,UNBO-3721,Separate out the PRIVATE_MOCK_SERVER to individual mocks
535507,UNBO-3720,Investgate why desktop visual tests take 15 minutes
535505,UNBO-3719,Delete Cypress videos for passing specs
535498,UNBO-3718,Upgrade configs to Typescript where possible
535371,UNBO-3717,Not able to include an apostrophe for Best Bets
535363,UNBO-3715,Card links not covering whole card
535296,UNBO-3714,Move accessibility hub navigation over to the new nav
535012,UNBO-3713,Add shared astro config
534951,UNBO-3712,Notice site - Phase 2
534906,UNBO-3711,Add in additional sites to the Page Performance tool
534868,UNBO-3710,New Relic test of deforestation maps for console errors
534790,UNBO-3709,Update ESLint to v9
534787,UNBO-3708,Integrate Website Carbon information into the Page Performance tool
534778,UNBO-3707,Share Price mock is broken since feature was redesigned
534769,UNBO-3706,Check the node runtime version of all Netlify sites
534765,UNBO-3705,Create a clone 'development' google tag container of unilever.com
534743,UNBO-3704,Palm oil story - minor copy edits 
534710,UNBO-3703,Brand profile social media component position
534708,UNBO-3702,Decouple brand profile country tabs from country filter
534703,UNBO-3701,Visual tests workflow is triggering global when desktop selected
534394,UNBO-3700,Actions (sort by title for example) under Brands not working
534323,UNBO-3697,Add 'open' toggle to accordion items 
534060,UNBO-3695,Palm Oil maps package incompatibility - deckgl 9.0.1 did not render PathLayer
534058,UNBO-3694,Brands filter should be called 'Location' rather than 'Country'
534025,UNBO-3693,Deck GL layers not rendering
534017,UNBO-3692,500 error on new market /brands pages
533877,UNBO-3691,CMS add new image shows a config invalid error
533871,UNBO-3689,Magnifying glass icon in hero search | Space alignment | Chrome vs Safari
533870,UNBO-3688,Hero Search: Safari search button
533861,UNBO-3687,Share Price - Fallback field feeds into Error slot
533846,UNBO-3686,Review for Automation - Share price refactor
533823,UNBO-3685,Remove visual testing from ci web corporate and web wiop workflows
533802,UNBO-3684,Move autoblock script position from <body> to <head>
533713,UNBO-3683,Review for Automation - Refactor Search Hero module
533657,UNBO-3682,Chart animation cause issues with Percy snapshots
533636,UNBO-3680,"Pages in Draft mode show as duplicated in ""Where is a schema type used?"""
533633,UNBO-3679,Feature component does not align correct in RTL setting
533522,UNBO-3678,Update Debt Investor highchart
533521,UNBO-3677,Enable the ability to not have a link to a brand page on the brand profile selection list and filter
533499,UNBO-3676,Brand Section - Country Filter
533077,UNBO-3674,Review distilled sites results - 2024-04-01
533067,UNBO-3673,Delay loading cookie consent and analytics until user interaction
533066,UNBO-3672,Update Twitter icon to X
533065,UNBO-3671,New navigation lacking active/current states
532976,UNBO-3670,Remove env var dependency on CYPRESS_AUTH_PASSWORD
