id,key,summary
443821,UNBO-947,/suppliers/unilever-practices-and-measures-related-to-covid19/ - Missing confirmation of acceptance option before viewing page content
443818,UNBO-946, /our-company/our-leadership/nils-andersen/ - h3 should be hidden when no social links on profile page
443817,UNBO-945,/our-company/our-leadership/nitin-paranjpe/ - Mobile view - h2 and quote in different positions
443814,UNBO-943,/our-company/the-logo/ - Data table displaying row sizes incorrectly
443809,UNBO-942,/our-company/strategy/ - Feature content (Sustainable growth section) is displaying text and image on opposite side
443808,UNBO-941,/our-company/our-approach/ - Missing section when nesting section in blodyblock 
443775,UNBO-940,Read time component does not appear on P&S pages 
443759,UNBO-939,Apply take action route to test publications
443618,UNBO-991,Access request
443614,UNBO-938,Sprint 14 automation tasks
443612,UNBO-937,Investigate image loads issues before Percy triggers
443564,UNBO-936,Look at changing the standards doc type from standard to digitalStandard
443542,UNBO-935,Review mobile breadcrumb test
443515,UNBO-934,look into the rooting of the form submission 
443501,UNBO-933,Update New Relic for separate desktop and mobile CI runs
443439,UNBO-932,Greece Brands - Resource field not reflecting
443418,UNBO-931,Brand Search page filters is not working as expected
443380,UNBO-930,Platform sub sites cannot use preview
443379,UNBO-929,India is failing the build on staging
443342,UNBO-928,Ability to add a document reference to a promo list ðŸŒ
443341,UNBO-927,"In-page nav (Trad, KBO, scre) ðŸŒ"
443340,UNBO-926,CLONE - In-page nav 
443339,UNBO-925, News and press alerts sign-up (Trad/Scre/Kbo) ðŸŒ
443338,UNBO-924,SDG block  ðŸŒ
443311,UNBO-923,Create Domain for Standards
443308,UNBO-922,Broken focus state on 'More topics' page section
443307,UNBO-921,Focus state on the 'more from Unilever' section is barely visible
443297,UNBO-920,"Card number not announced after link title i.e (2 of 18), in Take Action swimlane"
443294,UNBO-919,Link to section has moved to top right i.e â€˜More about Climate actionâ€™ 
443264,UNBO-918,No 'Skip this section' link in Take Action landing page
443165,UNBO-917,Execute Front End Test Cases
443164,UNBO-916,Create Front End Test Cases
443163,UNBO-915,Execute Front End test script
443162,UNBO-914,Create Front End test script
443161,UNBO-913,News title banner (Trad) ðŸŒ
443120,UNBO-912,Focus state in Initiative cta is not efficient and does not reflect Innovation site
443064,UNBO-911,Create a script to check every U.com page for the red serializer warning box
443061,UNBO-910,Configure Percy comparison for U.com
443060,UNBO-909,Add https://unilever.co.uk to New Relic checks
443059,UNBO-908,Implement an alternative approach to running mobile tests
443056,UNBO-907,Implement CI option to run with video = true
443046,UNBO-906,Maintenance 
442984,UNBO-905,Picture height with cover option
442981,UNBO-904,Update the spelling of aceptanceCriteria
442970,UNBO-903,Missing alt text from footer image
442966,UNBO-902,Enable the ability to link to a standard from a promo
442949,UNBO-901,Search issues
442946,UNBO-900,Archive and retrieve the EUDG content
442883,UNBO-899,Look into preview mode for standards site
442859,UNBO-898,Standards Login redirects you to the root all the time
442855,UNBO-897,Innovation : fix QA failures
442821,UNBO-896,Add in language locals for the new 8 WIOP sites
442769,UNBO-895,Take Action Initiative page Banner image isn't coming through
442767,UNBO-894,Main image not appearing 
442757,UNBO-893,unilevernepal.com does not redirect to the nepal site
442739,UNBO-1158,Alternative 'No Search Results' text 
442734,UNBO-892,Make the site name optional
442731,UNBO-891,Create a data migration script for Standards from Dev to Production
442728,UNBO-890,Set up the standards sites in Production
442724,UNBO-889,Update standards web codebase so it won't pull in standards for all sites
442722,UNBO-888,Get SEAC domains and set up SSL in Akamai
442721,UNBO-887,Create a document filter in the SEAC website.
442720,UNBO-886,Create stage and live SEAC websites in netlify
442719,UNBO-885,Create SEAC publication in the production dataset
442717,UNBO-884,SEAC site 
442716,UNBO-883,Review for Automation - Brand Purpose
442715,UNBO-882,Execute Front End Test Cases
442714,UNBO-881,Create Front End Test Cases
442713,UNBO-880,Review for Automation - Goal Box
442712,UNBO-879,Create Front End Test Cases
442711,UNBO-878,Execute Front End Test Cases - Goal Box
442710,UNBO-877,Execute Front End Test Cases
442708,UNBO-876,Create Front End Test Cases
442707,UNBO-875,Review for automation - Brand Division Page Template
442706,UNBO-874,Review for automation - Brand Division List
442705,UNBO-873,Execute Front End Test Cases
442704,UNBO-872,Create Front End Test Cases
442699,UNBO-990,Access request
442687,UNBO-871,Create news article export for those articles which have the old brand division tags and not the new business group tags
442559,UNBO-870,Make the descriptions field in the standards Schema full rich text
442547,UNBO-869,Migrate the CMS tests into Platform
442544,UNBO-868,Review how to ensure push to develop test results are known.
442522,UNBO-867,POC on upgrading to Cypress v10 
442520,UNBO-866,Investigate solution for Percy auth on sub-sites
442489,UNBO-865,Sprint 13 automation tasks
442483,UNBO-864,Update QA smoke test pack with go live sites
442439,UNBO-863,Latest results plumbing ticket
442438,UNBO-862,Iframes content in Tabs is not fitting the size of the space
442409,UNBO-861,"Huge spike in bot traffic on u.com, causing spike in Netlify bandwidth costs"
442315,UNBO-860,Playbook Preview 
442286,UNBO-859,Review for Automation - Category Page for Take Action 
442285,UNBO-858,Review for Automation - Landing Page for Take Action
442240,UNBO-857,Replace Got with Axios request package
442238,UNBO-856,Replace all Require with Import in framework
442234,UNBO-855,Baseline Percy for Prod
442227,UNBO-854,WIOP.co.uk items missing from nav and page a 404
442218,UNBO-853,extract of news articles - tagged with the old Divisions
442064,UNBO-842,Standards - acceptance criteria font size
442059,UNBO-841,Standards - headings
442012,UNBO-840,Australia - Contact from email address update
442008,UNBO-839,Wrong payloads for all prerender and onBeforeRender
442007,UNBO-838,Review Percy trial feature for real mobile devices
442005,UNBO-837,Migration - Refresh infrastructure documentation 
442003,UNBO-836,Migration - Automate deployment of API 
441994,UNBO-835,Look at putting the charts POC into Netlify so it can be accessed by non GitHub users
441992,UNBO-834,Innovation : investigate failures in QA
441988,UNBO-833,U.Lab brand page needs creating ðŸŒ
441986,UNBO-832,Alternative Oils Search TRAD-SCRE-KBO ðŸŒ
441935,UNBO-831,Publish Playbook edits 
441926,UNBO-825,Migration - Update WIOP Api for the 8 remaining Sites
441900,UNBO-824,Migration - Create redirects for the 8 remaining WIOP country sites for when they go live
441899,UNBO-823,Migration - Set up domains for 8 remaining WIOP sites
441898,UNBO-822,Set up netlify sites for 8 remaining WIOP sites
441897,UNBO-821,Create Publications for new WIOP publications
441895,UNBO-820,WIOP
441863,UNBO-819,Wiop UK - New page creation issue
441847,UNBO-818,Fix stage smoke test for innovation
441842,UNBO-817,Add temp solution for sub-sites authentication 
441834,UNBO-816,"Merge json QA, Stage and Prod data into one object set"
441807,UNBO-815,Autoplaying videos do not honour prefers-reduced-motion device settings 
441777,UNBO-814,Focus state on search filters and around the pages seems to be cut off
441773,UNBO-812,Popup with Popular Brand (FAKE TICKET)
441768,UNBO-811,"'Clear all Filters' button only clears 'Date Range' filters, not 'Type' filter"
441759,UNBO-810,Error handling seems to not be very consistent on Contact Us form
441755,UNBO-809,Contact us for does not explain mandatory field icon
441745,UNBO-808,"After activating checkboxes in filters using keyboard navigation, the focus shifts to results causing breakpoint and journey issues"
441735,UNBO-807,From date and End date do not meet expected criteria
441732,UNBO-806,Filter check box size is not consistent and changes through breakpoints
441731,UNBO-805,Swimlane button translations
441720,UNBO-804,Sub-site build issues
441711,UNBO-803,Investigate how to utilise Slack bot for forwarding QA Stage smoke test notifications
441684,UNBO-802,Nola-homepage promoted item
441627,UNBO-801,Percy run for go live sites
441562,UNBO-800,Rewrite cy recursive for modal to reclick card and then check repeated
441546,UNBO-799,Numbers always 0 on load for any filters on search results
441545,UNBO-798,Move .click() inside launch modal recursive function
441459,UNBO-797,The test automation site has 2 Ice Creams in the navigation but only one page
441443,UNBO-795,Continue redesign ifMobile() code into beforeEach() hooks for all test files
441435,UNBO-794,Review CSV's and run Percy checks for a batch of sites
441408,UNBO-793,Slack notifications fix required for 'DEV fukll suite of tests' on push
441403,UNBO-792,Execute Test Scripts
441402,UNBO-791,Create Test Scripts
441401,UNBO-790,CLONE - Execute Crud Test Scripts
441400,UNBO-789,CLONE - Create Crud Test Scripts
441399,UNBO-788,Brands feature video TRAD-SCRE-KBO ðŸŒ
441384,UNBO-779,Review for Automation - Initiative CTA Panel
441383,UNBO-778,Execute Front End Test Cases
441382,UNBO-777,Create Front End Test Cases
441379,UNBO-776,Broken video in Suppliers area
441366,UNBO-775,Innovation - Add test for brands ice-cream
441365,UNBO-774,(Innovations) review for automation - Country site Brands filter/listing
441344,UNBO-757,fix failures in QA platform
441343,UNBO-756,review swimlane swipe 
441342,UNBO-1119,Japan Press release displaying content that is not in the CMS
441289,UNBO-751,Initiative CTA  Panel TRAD-SCRE-KBO ðŸŒ
441286,UNBO-755,2A variant causing build to stage to fail
441277,UNBO-754,Improve Search to search Files
441247,UNBO-750,Review for automation - Investor Listing Item
441246,UNBO-749,Create test content - Investor Listing Item
441244,UNBO-748,Execute Front End Test Cases
441243,UNBO-747,Create Front End Test Cases
441242,UNBO-746,Execute Front end tests - Investor Listing Item
441241,UNBO-745,Review for Automation - Initiative Tag
441240,UNBO-744,Create Front end tests - Investor Listing Item
441239,UNBO-743,Review for Automation - Initiative Page
441238,UNBO-742,Execute Front End Test Cases
441237,UNBO-741,Create Front End Test Cases
441236,UNBO-740,Execute Front End Test Cases
441235,UNBO-739,Create Front End Test Cases
441234,UNBO-738,Review for Automation - Latest Results
441233,UNBO-737,Review for automation - Investor Listing
441232,UNBO-736,Review for Automation - Share Price
441230,UNBO-735,Execute Front End Test Cases
441229,UNBO-734,Create Front End Test Cases
441228,UNBO-733,Execute Front end tests - Investor Listing
441227,UNBO-732,Create Front end tests - Investor Listing
441223,UNBO-731,Review failures in QA for static
441220,UNBO-730," View all ""Business Group filter"" news does not pre filter the news (platform side)"
441219,UNBO-729,"View all ""Business Group filter"" news does not pre filter the news"
441212,UNBO-728,Clean up old brand division data
441209,UNBO-727,The latest news component does not work with the new business groups (Platform side)
441188,UNBO-726,Sprint 12 automation tasks
441157,UNBO-725,Accessibility Hub 
441124,UNBO-724,The latest news component does not work with the new business groups 
441117,UNBO-723,Create script to test search on all live sites
441088,UNBO-722,The build didnt fail when the search index wasn't populated
440973,UNBO-721,Post GH PR id (or other unique ID) to New Relic
440920,UNBO-720,Lead brands without a business group defined
440907,UNBO-719,HUL stage is failing the build.
440906,UNBO-718,Unilever South Africa- technical issues
440867,UNBO-717,Table Row span option
440762,UNBO-716,All items are announced the same in secondary level of navigation
440761,UNBO-715,Submenus announce number of items wrong
440760,UNBO-714,Navigation submenus not announcing menu expand/ collapse
440755,UNBO-713,Review .skip() tests that were waiting for filter clear functionality
440711,UNBO-712,leadership swimlane alignment- CTA
440709,UNBO-711,Screenreader does not announce position of user on the swimlane (i.e promo 2 of 10)
440619,UNBO-710,Enable brand URL to change to the new business groups on the platform side
440618,UNBO-709,Add brand redirects on platform side
440611,UNBO-708,update QA domain list
440610,UNBO-707,Review the usage of every cy.wait()
440603,UNBO-706,Playbook Site failing to build
440591,UNBO-705,Create script to export migrated sites list
440582,UNBO-704,Brand division list icons (removal)
440572,UNBO-753,Implement URL breadcrumb on search results - DUPLICATE
440570,UNBO-752,Implement URL breadcrumb on search results
440568,UNBO-702,Belgium Brands site link section heading appear when there is no content present
440564,UNBO-701,Navigating with keyboard skips last few cards in swimlane
440554,UNBO-700,Look into how we deal with the design develop branch ( https://design-develop-2.unileverstatic.com/planet-and-society/hub2/  )
440552,UNBO-699,Change clear filter on the our brands page to resemble the all new list and filter 
440549,UNBO-698,Change ordering on brand family filters on News and brands 
440520,UNBO-697,DACH site is missing country identifiers in brands section 
440483,UNBO-696,Review failing tests in `Static` repo
440482,UNBO-695,Update `Static` json data for migrated sites
440468,UNBO-693,Brand division list- Personal Care is not being pulled
440424,UNBO-692,First related brand sits higher then the rest
440402,UNBO-691,Media contacts section missing on hungary
440400,UNBO-690,Contact link and text missing on brand pages
440399,UNBO-689,Review for Automation - Tag list
440398,UNBO-688,Execute Front End Test Cases
440397,UNBO-687,Create Front End Test Cases
440386,UNBO-694,Greece brand profile showing a bug strip
440384,UNBO-686,fix QA failures
440360,UNBO-685,Update Snippet for Accessibility Contact Us Form
440346,UNBO-682,Unique CookieQ will need for DACH site
440345,UNBO-681,Brand page has social links component when there are no links
440344,UNBO-680,Brand listing page missing the background and image
440343,UNBO-679,QA https://qa-netlify.unilever.be has 15 404 pages in brands URL's
440273,UNBO-678,Message Block text does not read out as one paragraph
440262,UNBO-677,Investigate flaky modal test
440241,UNBO-676,"Look at adding Author, Read time & Publish date for pages and landing pages"
440240,UNBO-675,Output related standards
440239,UNBO-674,Output Author on standards
440238,UNBO-673,Create 4 body blocks for the standards
440219,UNBO-666,standards - standards list issue
440218,UNBO-665,Standards - releated links issue
440216,UNBO-664,Standards - Image issue
440161,UNBO-663,Update smoke test for QA with brands and EUDG
440160,UNBO-662,"Percy for Canada, North latin and Japan"
440087,UNBO-796,Brands Sections for countries on staging not reflecting properly
440086,UNBO-661,Review Cypress / Percy waiting for taking snapshots
440085,UNBO-660,Rework all the authentication code for multi language sites
440084,UNBO-659,Main navigation no using translated text
440029,UNBO-658,Keypoint becomes very narrow at certain breakpoints
440008,UNBO-657,Create Platform version of the test manual site
440006,UNBO-656,Disable unused workflows from running on schedule
440003,UNBO-655,Keypoint image is read as 'Clickable' by NVDA Screenreader
439950,UNBO-654,"Analytics test on Middle East, Singapore, Malaysia, Italy"
439930,UNBO-653,Repetition of readout when navigating AKA Brands with screenreader
439922,UNBO-652,Investigate table formatting of Cypress data has become messed up
439683,UNBO-651,Brands AKA component isn't scaling correctly for breakpoints and zoom
439624,UNBO-650,Automation Backup sub task
439623,UNBO-649,News article not using supplied video
439581,UNBO-648,Content changes for Canada sites 
439532,UNBO-635,Content change needed to the description list on the Thailand site in the EUDG section
439519,UNBO-634,Feature video not scaling to space
439514,UNBO-633,File and shareprice function errors
439513,UNBO-632,assets link and favicon 404
439512,UNBO-631,news feed 404
439511,UNBO-630,investor feed 404
439510,UNBO-629,autodiscover 404
439509,UNBO-628,akamai sureroute 404  
439508,UNBO-627,autodiscover 404
439507,UNBO-626,akamai sureroute 404
439491,UNBO-625,Sprint 11 automation tasks
439488,UNBO-624,AWS account issues
439485,UNBO-1382,Bold text font in intro field dominates normal texts
439429,UNBO-623,Feature component not full width on brand sites
439427,UNBO-622,Brands listing page search uses page content
439379,UNBO-621,Feature Title Banner Plumbing
439378,UNBO-620,Goal Summary Plumbing
439377,UNBO-619,Description List Plumbing ðŸŒ
439370,UNBO-618,(Platform) review for automation - Country site Brands filter/listing
439368,UNBO-617,execute Front end tests - Country site Brands filter/listing
439367,UNBO-616,Create Front end tests - Country site Brands filter/listing
439300,UNBO-615,Amend related articles to allow press releases
439224,UNBO-614,Set up of standard site 
439208,UNBO-613,Review for autmation - Tabs
439207,UNBO-612,Execute Front end tests - Tabs
439206,UNBO-611,Create Front end tests - Tabs
439204,UNBO-610,Review for automation - Swimlane
439203,UNBO-609,Execute Front end tests - Swimlane
439202,UNBO-608,Create Front end tests - Swimlane
439200,UNBO-607,Review for automation - Keypanel
439199,UNBO-606,Execute Front end tests - Keypanel
439198,UNBO-605,Create Front end tests - Keypanel
439197,UNBO-604,review for automation - Message block
439196,UNBO-603,Execute Front end tests - Message block
439195,UNBO-602,Create Front end tests - Message block
439194,UNBO-601,Review for automation - Brand AKA
439193,UNBO-600,Execute Front end tests - Brand AKA
439192,UNBO-599,Create Front end tests - Brand AKA
439190,UNBO-598,Review for automation - Brand Title Banner
439189,UNBO-597,Execute Front end tests - Brand Title Banner
439188,UNBO-596,Create Front end tests - Brand Title Banner
439187,UNBO-595,review for automation - Language selector
439186,UNBO-594,Execute Front end tests - Language selector
439185,UNBO-593,Create Front end tests - Language selector
438953,UNBO-592,Update the response to the generatePage function if it renders a non existent page to 404
438936,UNBO-591,Enable the news and brands list and filter to surface the new Business groups 
438892,UNBO-589,pull quote displaying incorrectly
438890,UNBO-588,footnotes in the wrong order
438882,UNBO-587,Feature with video is not scaling
438872,UNBO-586,Greece - error page is not appearing correctly for news articles and press releases
438867,UNBO-684,Change Search Filters to behave as 'or' rather than 'and'
438836,UNBO-672,Review For Automation - Allow Press Release in Related Article
438835,UNBO-671,Execute Back End Test Cases
438834,UNBO-670,Create Back End Test Cases
438833,UNBO-669,Execute Front End Test Cases
438832,UNBO-668,Create Front End Test Cases
438658,UNBO-584,"Create a new page ""monitor.json"" for all sites on platform "
438650,UNBO-583,Focus does not move into the model - NVDA
438639,UNBO-582,Modal not opening with JS disabled (Safari)
438636,UNBO-581,Modal CTA missing arrow
438633,UNBO-580,Modal Icon placement changed
438571,UNBO-645,Get a list of redirects for the business reorg
438530,UNBO-579,Refactor smoke test
438528,UNBO-578,Create Percy for Hive
438527,UNBO-577,Percy runs for go live sites
438446,UNBO-576,Authored by text missing
438443,UNBO-575,"Enable greece, hong kong and Taiwan to view the brand content in QA"
438442,UNBO-643,Review For Automation - Enable the news and brands list and filter to surface the new Business groups 
438441,UNBO-642,Execute Front End Test Cases
438440,UNBO-574,Listing plumbing
438439,UNBO-641,Create Front End Test Cases
438379,UNBO-573,Tech Debt: Refactor RowBlock schema and processor
438284,UNBO-572,upgrade Cypress V10
438239,UNBO-640,Enable the news and brands list and filter to surface the new Business groups 
438144,UNBO-569,Baseline Percy for live and QA sites
438143,UNBO-568,Migrate test for Filters
438139,UNBO-567,Standards - List and filter: Download all standards in CSV
438138,UNBO-566,Standards - Single sign on
438137,UNBO-565,Standards - List and filter
438042,UNBO-570,Pdfs not working on Platform country websites
437767,UNBO-1691,.COM & Corporate sites - (NEW) (P3) All form labels should have a 'alt' attribute
437746,UNBO-564,Alternative Oils add script to generate the json before running the test
437744,UNBO-563,Sprint X automation tasks
437673,UNBO-638,Image inside of statement component causes a rebuild fail
437660,UNBO-562,Sprint 10 automation tasks
437611,UNBO-561,callout card not float right
437575,UNBO-560,Case study title issue
437574,UNBO-559,Author Profiles missing
437573,UNBO-558,Standfirst intro paragraph not bold
437566,UNBO-557,Unilever Middle East missing image
437536,UNBO-637,Cookie and privacy notice text issues
437532,UNBO-556,Brand filter migration test
437437,UNBO-555,Expand json production dataset with publications 'country'
437286,UNBO-554,Look at Publishing model
437194,UNBO-553,Add QA/Stage smoke test for Location Selector = true for Taiwan
437154,UNBO-1425,Case studies are not recognizing Subscript text
437127,UNBO-552,Add wait for all search filters before taking Percy snapshot
437095,UNBO-551,Review the .skip() tests
437049,UNBO-646,Onetrust updates and fixes
437040,UNBO-550,Promo list not central in the israel site
437038,UNBO-549,Search results not loading
436950,UNBO-548,Search filters loading at different speeds causing interaction/ux issue
436945,UNBO-547,qa.unilever.co.il is not pointing to qa-netlify.unilever.co.il
436813,UNBO-546,News Landing page missing Press releases hero Card
436811,UNBO-545,Change location button on Taiwan
436810,UNBO-544,Mobile breadcrumb showing the child arrow when not applicable
436808,UNBO-543,Israel using wrong quote variant
436807,UNBO-542,Israel Homepage wrong hero search
436633,UNBO-541,This is a test ticket raised from Netlify draw
436618,UNBO-540,Statement image not square
436570,UNBO-538,Generate Percy comparison builds for sprint 9 releases
436568,UNBO-537,Merge stage smoke test in QA design
436361,UNBO-536,Review for automation - Case Study
436360,UNBO-535,execute front end tests - Case Study
436359,UNBO-534,Verify and migrate front end tests - Case Study
436357,UNBO-533,Review for automation - Modal
436356,UNBO-532,Execute Front end tests - Modal
436355,UNBO-531,Create Front end tests - Modal
436339,UNBO-530,Add test for news filter
436280,UNBO-529,UnileverShilling font is not being passed into Percy due to authentication failure
436234,UNBO-526,Sprint 9 automation tasks
436231,UNBO-528,Platform- Media contacts section missing
436230,UNBO-527, Platform- News landing page missing text
436222,UNBO-525,Remove Cookie Settings button from Percy
436215,UNBO-524,Percy baseline new 3 sites gone live
436166,UNBO-523,"Test analytics for Poland, Magreb and Romania on live"
436159,UNBO-522,Part 2 modify workflow to use release hook as parameter for main and preprod
436158,UNBO-521,Investigate Percy Stage Korea error
436145,UNBO-520,Investigate Percy issues in dynamic generated sites
436133,UNBO-519,Breadcrumb mobile behaviour changed
436132,UNBO-518,Inline heading links insufficient contrast
436131,UNBO-517,QA romania missing an image present on live
436104,UNBO-516,Update QA smoke test
436080,UNBO-515,Update QA sites smoke test to match updated json structure
436012,UNBO-647,Rotate the api keys for search user
435801,UNBO-514,Redesign QA json of test publication data
435796,UNBO-513,platform site search results not displaying keyword results
435792,UNBO-512,Press release listing pull through far too much page content
435789,UNBO-511,Update the ENV variables for vendors
435780,UNBO-510,Include search in QA and Stage smoke tests
435702,UNBO-509,Create foundation of NewRelic dashboard for Platform
435697,UNBO-508,Modify web corp workflow to env release type as a parameter to select tests to run
435695,UNBO-507,Tag integration tests with @smoke for running in PR's
435496,UNBO-506,Poland - Serializer missing for section
435488,UNBO-505,Resolve issues identified in the netlify logs
435391,UNBO-504,Add integration tests for /news/ i.e. date filtering
435373,UNBO-503,Update the routing of a sub site (i.e. https://www.unilever.be/fr/)
435334,UNBO-502,Analytics Korea - missing events
435280,UNBO-501,Review for automation - row block
435279,UNBO-500,Execute Front end tests - Row Block
435278,UNBO-499,Create Front end tests - Row Block
435277,UNBO-498,review for automation - Signpost
435276,UNBO-497,Execute Front end tests - Signpost
435275,UNBO-496,Create Front end tests - Signpost
435274,UNBO-495,review for automation - Press and Media Card
435273,UNBO-494,Execute Front end tests - Press and media card
435272,UNBO-493,Create Front end tests - Press and media card
435270,UNBO-492,Review for automation - listicle
435269,UNBO-491,Execute Front end tests - Listicle
435268,UNBO-490,Create Front end tests - Listicle
435266,UNBO-489,Review for automation - Brand page template
435265,UNBO-488,Execute Front end tests - Brand page template
435264,UNBO-487,Create Front end tests - Brand page template
435146,UNBO-485,Percy baseline Prod and Stage Korea
435121,UNBO-484,Add environment variable for stage mode for Korea 
435099,UNBO-483,Review for automation - Text Block
435098,UNBO-482,Execute Front end tests - Text Block
435097,UNBO-481,Create Front end tests - Text Block
435096,UNBO-480,review for automation - feature
435095,UNBO-479,Execute Front end tests - Feature
435094,UNBO-478,Create Front end tests - Feature
435093,UNBO-477,review for automation - Statement
