id,key,summary
481834,UNBO-2354,"Filter GA custom header sent from NewRelic ping test ""newrelic:true"""
481444,UNBO-2353,Google analytics showing Linux Bot Traffic
481094,UNBO-2352,Plumbing
481093,UNBO-2351,Backend 
481092,UNBO-2350,Frontend
481071,UNBO-2349,Add into Akamai configuration
481069,UNBO-2348,Add to Google search console 
480865,UNBO-2347,Sprint 33 automation tasks
480863,UNBO-2346,Migrated extendedImage to assetImage
480765,UNBO-2345,Automation - add utocomplete to form fields (form builder) Custom Form / Newsletter Signup
480762,UNBO-2344,Roll back percy cli to 1.18.0 to investigate SecurityError: Failed to execute 'toDataURL'
480633,UNBO-2343,Remove cy.request ignore failed status codes on studio launch
480609,UNBO-2342,Callout text
480608,UNBO-2341,Promo list variant
480603,UNBO-2340,Message block variants
480598,UNBO-2339,Highlight text
480597,UNBO-2338,Statement variant 
480594,UNBO-2337,Tower promo
480592,UNBO-2336,Content Chapters and Chapter Nav
480591,UNBO-2335,Hero section
480588,UNBO-2334,Feature pale grey variant 
480584,UNBO-2333,Rowblock purple variant 
480582,UNBO-2332,Add orchid purple section variant 
480581,UNBO-2331,Add forest green section variant 
480576,UNBO-2330,IR equity components 
480571,UNBO-2329,Location selector page redesign for additional sites
480510,UNBO-2328,Update Percy validation verfiySearchFiltersHaveLoaded for new Search X Results code
480195,UNBO-2327,Add additional languages to sanity
480157,UNBO-2326,Home page video buttons tabbing order
480127,UNBO-2325,Improve Studio -> Media Percy validate all items have loaded
480061,UNBO-2324,Add redirect for the following PDF's
480031,UNBO-2323,Review QA failures
479883,UNBO-2322," News feed - driven by a Business Group, Topic or Tag"
479858,UNBO-2321,Float right components to be excluded from screen reader read out 
479856,UNBO-2320,Remove dates from Initiatives on Take Action page
479855,UNBO-2319,Remove reading times from news articles 
479834,UNBO-2318,Images are being replaced with a blank video
479779,UNBO-2317,Investigate Percy errors in QA smoke tests
479771,UNBO-2316,Upgrade @percy/cli 1.21.0 -> 1.23.0
479544,UNBO-2315,AbilityNet UAT - Add autocomplete to form fields (form builder) Contact Us Salesforce
479455,UNBO-2314,Image on WIOP site blocking text 
479443,UNBO-2313,Review QA failures
479217,UNBO-2312,Implement GA tagging on Best Bets search result
479216,UNBO-2311,Add Best Bets to the Content Helper
479210,UNBO-2310,Meta description for leadership profiles 
479169,UNBO-2309,Set up Health monitoring - (New Relic - synthetic)
479168,UNBO-2308,Site check
479166,UNBO-2307,Set up and test GA4 configuration
479165,UNBO-2306,Set up SSL in Akamai 
479163,UNBO-2305,Create default home page for site
479161,UNBO-2304,Set up environments (QA and Prod) for Oleo chemicals 
479160,UNBO-2303,Set up domain up domain name for Oleo chemicals - www.unileveroleochemical.com and www.unileveroleochemical.com/id  
478883,UNBO-2302,Sanity v3 - Adding hyperlink to text does not launch the Link modal
478700,UNBO-2301,Test all sites using a Contact form to ensure that a success page is returned
478693,UNBO-2300,Convert New Relic non functional script from Step Monitor to Scripted Browser
478468,UNBO-2299,Sanity v3 - Bangladesh language is missing
478466,UNBO-2298,Sanity v3 - Unpublishling a document which refers to other documents does not give useful warning
478416,UNBO-2297,Sanity v3 - Web Preview shows error 500
478401,UNBO-2296,Review failures for automation
477809,UNBO-2295,It seems the Q results promo can't just have an image at the moment. It needs a video
477808,UNBO-2294,"Sanity V3: Missing ""Create New"" button when embedding assets (image/pdfs/vdeos)"
477807,UNBO-2293,Sanity V3: Media tool is broken
477806,UNBO-2292,New domain request (Oleochemical)
477764,UNBO-2291,Sanity - Verify document reference
477761,UNBO-2290,Sanity - helper download csv 
477759,UNBO-2289,Sanity - verify rebuild website 
477539,UNBO-2288,Contact us snippet update
477526,UNBO-2287,Look at Jira automation to automatically publish releases
477512,UNBO-2286,Fix release(qa): v3.2.0 h3 title bug
477441,UNBO-2285,Intros on News Search page are being truncated
477332,UNBO-2284,AbilityNet UAT - Site search Non JS text
477328,UNBO-2283,AbilityNet UAT - Screen reader Search results count not read on resubmission
477324,UNBO-2282,AbilityNet UAT - In Nav site search field
477323,UNBO-2281,AbilityNet UAT - Add autocomplete to form fields (form builder) Custom Form / Newsletter Signup
477322,UNBO-2280,AbilityNet UAT - Add video Titles to play/pause and transcript buttons
477321,UNBO-2279,AbilityNet UAT - Investigate reduced motion and Autoplaying videos
477318,UNBO-2278,Issues raised from AbilityNet User Testing
477317,UNBO-2277,AbilityNet UAT - Pause button on automatically moving content is not visually prominent
477313,UNBO-2276,/contact-us-success is redirecting to /
477252,UNBO-2275,Axe Dev Tools - Serious Warning - Two serious warnings highlighted
477249,UNBO-2274,Axe Dev Tools - Critical Warning - Ensures every form element has a label
477243,UNBO-2273,JSSCounter is again dropping before OT banner interaction
477099,UNBO-2272,Investigate Distilled Sites CI error
477090,UNBO-2271,Re-enable the NR alerts for UOL - Synthetic header scripts
477076,UNBO-2270,Keyboard focus can be taken outside of the <Cookie Accept> modal to other elements on the screen
477075,UNBO-2269,Second modal loaded takes focus away from <Cookie Accept> modal
476407,UNBO-2268,Accessibility test the OneTrust banner when in centre position eg. Knorr.com NL site
476194,UNBO-2267,The cookie notice on WIOP (Austria) is not working correctly
476158,UNBO-2266,Create CMS guide in playbook for creating a Brand
476116,UNBO-2265,Bowen Craggs survey issue
476109,UNBO-2264,Content Group Query
475922,UNBO-2260,Sanity - Percy for panel view inside publication
475920,UNBO-2259,Sanity - Hierarchy browser
475918,UNBO-2258,Sanity - Iframe Panel view
475916,UNBO-2257,Sanity - Documents Reference
475913,UNBO-2256,Sanity - Assert Preview
475881,UNBO-2255,Add slugs to assets
475880,UNBO-2254,Append filename to the 'large file redirect' PDFs
475878,UNBO-2253,Clean up tags
475829,UNBO-2252,Re route assets.unilever.com
475790,UNBO-2251,Update test for sanity panel layout
475781,UNBO-2250,Sprint 32 automation tasks
475779,UNBO-2249,skip test for panel layout
475769,UNBO-2248,Allow all editors to see submenu field
475761,UNBO-2263,Search function: case sensitive and spelling sensitive
475757,UNBO-2247,Sanity V3 - Helpers Menu - <Where a module is used> search results for Sanity pages do not open in a new tab
475751,UNBO-2246,Accessibility of the OneTrust banner
475750,UNBO-2245,OneTrust banner positioning
475749,UNBO-2244,Establish our OneTrust technical account manager
475748,UNBO-2243,Cookies and OneTrust maintenance
475747,UNBO-2242,Contact Akamai to discuss cookie 'akacd_phasedrelease3'
475737,UNBO-2241,Review failures in QA
475683,UNBO-2240,Fix Mochawesome ERROR: Failed to merge reports in Studio Corporate 
475667,UNBO-2239,Google Analytics Data Issue
475643,UNBO-2238,Enhance the NR synthetic cookie test after the rouge cookie issues have been resolved
475618,UNBO-2237,Create POC for Dark mode 
475601,UNBO-2236,Add web preview URL for where schema used results
475600,UNBO-2235,Export the where schema used results to Excel
475566,UNBO-2234,Investigate NR monitors alert indicators are not dispalying correctly
475503,UNBO-2233,Google Analytics - new user request
475418,UNBO-2232,"Content Groups - Image embed, large variant isn't displaying as large"
475411,UNBO-2231,Content Groups - Business Group list isn't nesting correctly
475389,UNBO-2230,Sprint 31 automation tasks
475374,UNBO-2229,PIOTI product search only returning a subset of products. 
475225,UNBO-2228,Issue with content groups - anchor links and read time 
474989,UNBO-2227,Click to call for phone numbers
474982,UNBO-2226,Close menu on ESC when focus is still on top level nav button
474899,UNBO-2225,Check V2 updates in V3 for UNBO-1941
474898,UNBO-2224,Check V2 updates in V3 for UNBO-2013
474897,UNBO-2223,Check V2 updates in V3 for UNBO-2074
474896,UNBO-2222,Check V2 updates in V3 for UNBO-2027
474893,UNBO-2221,Check V2 updates in V3 for UNBO-1988
474892,UNBO-2220,Check V2 updates in V3 for UNBO-1565
474891,UNBO-2219,Check V2 updates in V3 for UNBO-1407
474889,UNBO-2218,Check V2 updates in V3 for UNBO-2074
474888,UNBO-2217,Check V2 updates in V3 for UNBO-1959
474887,UNBO-2216,Check V2 updates in V3 for UNBO-2113
474886,UNBO-2215,Check V2 updates in V3 for UNBO-2107
474885,UNBO-2214,Check V2 updates in V3 for UNBO-2090
474884,UNBO-2213,Check V2 updates in V3 for UNBO-1778
474883,UNBO-2212,Check V2 updates in V3 for UNBO-2158
474882,UNBO-2211,Check V2 updates in V3 for UNBO-2130
474860,UNBO-2210,WIOP Cookie Notices
474830,UNBO-2209,Add the final Slack notifications for Sanity int results
474741,UNBO-2208,Review failures in QA
474725,UNBO-2207,Review for automation â€“ Sanity panel layout test
474719,UNBO-2206,Business Groups List - dynamic CTA doesn't work within a Content Group
474717,UNBO-2205,Create a Sanity V3 production instance
474675,UNBO-2204,Survey cookie 'JSSCounter' has gone rouge and is dropping immediately 
474633,UNBO-2203,Sanity v3 throws a 404 on /root after successfully authenticating user
474632,UNBO-2202,Upgrade @percy/cli to v1.21.0 and monitor the Safari mobile horizonal issue
474561,UNBO-2201,Update the field text field types
474560,UNBO-2200,Add an initial value of email and T & C field into the custom form
474559,UNBO-2199,Add in a field group field type
474556,UNBO-2198,Remove initial value from the custom form sanity text schema and make it placeholder
474553,UNBO-2197,Add the checkbox formatting to the label to fix the formatting of the custom form
474540,UNBO-2196,New Label processing
474356,UNBO-2195,MacOS + Safari: tab cycling excludes the page checkboxes
474331,UNBO-2194,Initial Values should be emptied on text field focus
474307,UNBO-2193,Initial Values set for REQUIRED form text fields have no IsEmpty validation
474299,UNBO-2192,Review for automation- add Kazakhstan site to JSON
474287,UNBO-2191,Time stamps on Press Releases
474268,UNBO-2190,When you download the ARA pdf on https://www.unilever.com/investors/annual-report-and-accounts/ it downloads True.pdf
474161,UNBO-2189,Investigate macOS 12.6.3 failing build step install dependencies
474134,UNBO-2188,Sanity - Include QA CMS and update workflow
474133,UNBO-2187,The LEAP form doesn't require a confirmation E - mail
474129,UNBO-2186,Create Terraform NR script for share price api
474128,UNBO-2185,Create Terraform NR script for cookie tracking
474127,UNBO-2184,Roll out the NR search-api tests to multiple countries
474114,UNBO-2183,Add canonical check to NR monitor
474108,UNBO-2182,Initial Values set for form text fields are not shown
474097,UNBO-2181,This form submit gives you an error page
474073,UNBO-2180,the new custom form fields 
474060,UNBO-2179,canonical ref is missing from the header
474048,UNBO-2178,Update V3 sanity schema for the custom form. 
474046,UNBO-2177,Heirarchy browser
473836,UNBO-2176,Search phase 1
473835,UNBO-2175,Add filters to the page to allow a user to refine their search result based on the content type and/or file type (U.com only):
473834,UNBO-2174,"Change behaviour so that documents downloads (DOCX, XLSX, PPTX, PDF) all sites"
473833,UNBO-2173,"Change the reading order of the results â€“ title, date if there is one, summary (all sites)"
473832,UNBO-2172,Move the position of the â€˜Skip to resultsâ€™ button â€“ as it covers the â€˜Keyword searchâ€™ text (all sites)
473831,UNBO-2171,Search results listed should be marked up semantically 
473830,UNBO-2170,Change the behaviour of the Search â€˜buttonâ€™ 
473797,UNBO-2169,Background's image on statement
473793,UNBO-2168,Review for Automation - LEAP competition form
473781,UNBO-2167,Execute B/E + F/E Tests - LEAP competition form
473780,UNBO-2166,Create B/E and F/E Tests - LEAP competition form
473765,UNBO-2165,Map accessabilityhub-qa.unilever.com onto https://standards-unilever-com-qa.netlify.app/
473570,UNBO-2164,AdChoices footer implementation
473560,UNBO-2163,Google Analytics Tagging - Browser Version
473555,UNBO-2162,WIOP Tagging & Analytics
473462,UNBO-2161,Enhance the New Relic 'search api' test to use BuildID returned from monitor.json
473452,UNBO-2160,Sanity - Update Percy for more subpages
473335,UNBO-2159,Gather data for New Relic browser support ticket
473287,UNBO-2158,create LEAP competition form
473286,UNBO-2157,Have the ability to suppress labels
473190,UNBO-2156,A test ticket to test Jira Automation
473159,UNBO-2155,Review failures in QA
473111,UNBO-2154,Sanity - Review for automation
473110,UNBO-2153,Sanity - Verify panel layout
473109,UNBO-2152,Sanity - Verify Navigation bar
473107,UNBO-2151,Sanity - Create percy for visual checks
473103,UNBO-2150,WIOP logo errors
473082,UNBO-2149,SSO for BrowserStack
473030,UNBO-2148,Reconfigure the New Relic synthetic certificate check script
473028,UNBO-2147,Sprint 30 automation tasks
473006,UNBO-2146,WIOP location Selector Image Change
472919,UNBO-2145,Problems with search function on unilever.de / .at / .ch
472918,UNBO-2144,Delete press contacts on the News page
472916,UNBO-2143,Update the github Readme with the new PR merging policy
472915,UNBO-2142,Look at Jira automation for PR merges
472913,UNBO-2141,Update Cypress to v12.8.0
472812,UNBO-2140,Implement CMS / Cypress repo structure to allow tests to be added
472779,UNBO-2139,Sitemap pages to be ordered alphabetically 
472761,UNBO-2138,Add subsites for Bangladesh 
472661,UNBO-2137,change bangali sites from ba to bn
472658,UNBO-2136,Update storybook to version that can use React 18 safely
472557,UNBO-2135,Relative font sizes â€“ OneTrust cookie banner styles
472552,UNBO-2134,clean up the external link in the hierarchy menu
472551,UNBO-2133,Remove hide this page functionality 
472550,UNBO-2132,Update website to pull new navigation
472549,UNBO-2131,Create a run script to migrate current navigation into new navigation
472548,UNBO-2130,Update the schemas to allow sub menus 
472437,UNBO-2129,Review failures in QA
472410,UNBO-2128,Add standards JWT authentication on https://uol-storybook.netlify.app/
472289,UNBO-2127,Configure S3 bucket for Terraform state file
472276,UNBO-2126,Components (automation)
472206,UNBO-2125,Add a ping test for large assets
472181,UNBO-2124,Accordions not updating the heading level within a Content Group
472165,UNBO-2123,Execute B/E Tests - Content Helper Enhancements
472164,UNBO-2122,Create B/E Tests - Content Helper Enhancements
471886,UNBO-2121,Listing pages filters heading levels
471883,UNBO-2120,Results component heading structure
471845,UNBO-2262,Search should prioritise entry term syntax over individual word frequency
471625,UNBO-2119,Refactor of standards specific code
471615,UNBO-2118,Debug CI axios failing in Netlify ping test
471559,UNBO-2117,Chart creation for Debt Investors page
471533,UNBO-2116,Gather the Lighthouse stats for Live Korea at end of test period
471523,UNBO-2115,Links in blue brand purpose module are purple  
471434,UNBO-2114,Negative test all the NRQL alerts
471425,UNBO-2113,Allow Business Group List in the Content Group
471359,UNBO-2112,The B&C survey is not showing on u.com
471333,UNBO-2111,Once SEAC is live the password will be disabled - automation auth needs to list SEAC prod as No Auth
471114,UNBO-2110,Sanity Content Helper 'where a schema is used' enhancements
471091,UNBO-2109,Downgrade @percy/cli to 1.18.0 to investigate a bug
470992,UNBO-2108,**** URGENT- SEAC - Footer menu - Contact us button is not working 
470985,UNBO-2107,There are misconfigured Sri Lanka values in Sanity 
470955,UNBO-2106,Review for Automation - Innovation and [BRAND] Promo List
470954,UNBO-2105,Execute BOTH B/E and F/E tests - Innovation and [BRAND] Promo List
470953,UNBO-2104,Create F/E tests - Innovation and [BRAND] Promo List
470952,UNBO-2103,Create B/E tests - Innovation and [BRAND] Promo List
470947,UNBO-2102,Redirect a PDF
470904,UNBO-2101,New Relic migrate existing alerts from INFRASTRUCTURE METRIC to NRQL QUERY 
470820,UNBO-2100,Create an environment for Comms for mock-ups
470815,UNBO-2099,"Ensure we stub all videos as autoplay=""false"""
470801,UNBO-2098,Accessibility error in headings structure QA
470792,UNBO-2097,Sprint 29 automation tasks
470782,UNBO-2096,Set up GA4 for the Notice site
470779,UNBO-2095,Set up GA4 for the Kazakhstan sites
470777,UNBO-2094,Add New Relic script to Korea live site for 1 week and take daily Lighthouse scores
470776,UNBO-2093,Set up GA4 for the Bangladesh UCCL sites 
470775,UNBO-2092,Set up GA4 for the Bangladesh corporate sites 
470774,UNBO-2091,Set up GA4 for the SEAC site
470770,UNBO-2090,Move the titles of the listings to be standard page titles
470756,UNBO-2089,AbilityNet - Focus order includes off-screen interactive elements
470745,UNBO-2088,Remove date range from search
470706,UNBO-2087,Brands
470650,UNBO-2086,List & Filters
470648,UNBO-2085,Tags on Standards
470647,UNBO-2084,Add assets.unilever.com into google site managed
470638,UNBO-2083,Execute front end test cases - Add option to show no date on promo list
470636,UNBO-2082,Review for Automation - Add option to show no date on promo list 
470625,UNBO-2081,News Feed heading level not updating
470614,UNBO-2080,DQM connector set up - WIOP sites
470533,UNBO-2079,Schemas (testing)
470518,UNBO-2078,The WIOP DQM integration doesn't work 
470419,UNBO-2077,Accessibility Hub - 2 h1s on standards pages
470390,UNBO-2076,Sanity SSO - Set up Admin and Viewer AD accounts
470375,UNBO-2075,"On adding the 5th, 6th and 7th Business Group items no default OR Custom CTA is shown"
470365,UNBO-2074,External links to a Business Group list item can be added without a custom CTA where no default CTA is then applied
470358,UNBO-2073,"When adding a link to an internal page, a Custom CTA is required for a Business Group list item"
470342,UNBO-2072,Review all ToDo items
470329,UNBO-2071,Error Login Sanity
470189,UNBO-2070,Review for Automation - Business Groups list component CTA button redesign
470188,UNBO-2069, Execute both sets of tests - Business Groups list component CTA button redesign
470187,UNBO-2068,Create Back End tests - Business Groups list component CTA button redesign
470186,UNBO-2067,Create Front End tests - Business Groups list component CTA button redesign
470181,UNBO-2066,Decommission the old standards site 
470153,UNBO-2065,Investigate managing devDependencies from root of monorepo
470135,UNBO-2064,Add New Relic browser monitor script to _default.page.server.ts
470134,UNBO-2063,KZ-KZ and RU-KZ  - slug name issue
470124,UNBO-2062,Extra margin observed in listacle 
470030,UNBO-2061,SVGs aren't outputting alt text
470022,UNBO-2060,KPI Reporting - CWV report
470010,UNBO-2059,Staging site links within the SEAC site 
470009,UNBO-2058,Tab list on SEAC site being cut off 
469985,UNBO-2057,Translator issue on KZ-KZ and RU-KZ websites
469967,UNBO-2056,When there are no IR listing items in the page filter the build failes
469966,UNBO-2055,create QA sites for SEAC and other new ones
469867,UNBO-2054,Planet and Society link page to 2021 results page when it should be the latest
469861,UNBO-2053,Brands Authoring Tool (discuss with team)
469860,UNBO-2052,Parts list (remove)
469859,UNBO-2051,Docs (remove)
469858,UNBO-2050,Vision (migrate)
469857,UNBO-2049, Media (migrate)
469856,UNBO-2048,"Content Helper (migrate, rename to â€˜Helpersâ€™)"
469855,UNBO-2047,"Rebuild websites (migrate, rename to â€˜Deployâ€™)"
469854,UNBO-2046,Superscript Renderer (migrate)
469853,UNBO-2045,Subscript Renderer (migrate)
469852,UNBO-2044,Status Badges (migrate)
469851,UNBO-2043,Unpublish Action (migrate)
469850,UNBO-2042,Publish Action (migrate)
469849,UNBO-2041,Preview Action (replaced by preview pane)
469848,UNBO-2040,Linked Preview (migrate)
469847,UNBO-2039,DQM Checker Pane (migrate)
469846,UNBO-2038,Iframe/Website Preview Pane (replace)
469845,UNBO-2037,Document Reference (replace)
469844,UNBO-2036,Copy Action (migrate)
469843,UNBO-2035,Asset Preview (migrate)
469842,UNBO-2034,Logo (migrate)
469841,UNBO-2033,Tools
469840,UNBO-2032,Components
469839,UNBO-2031,Schemas (development)
469838,UNBO-2030,Workspaces
469802,UNBO-2029,Heading varies between h2 and h3
469789,UNBO-2028,Add seac QA site to json
469645,UNBO-2027,Business Groups list component call to action button redesign
469641,UNBO-2026,AbilityNet - Video transcripts aren't rendering on the front-end for all instances
469630,UNBO-2025,Create back end test cases & execute test(s)
469629,UNBO-2024,Create Front end test cases & execute tests
469614,UNBO-2023,Review for Automation - Move SDGs to the bottom of the page
469580,UNBO-2022,Brazil contact us form change
469579,UNBO-2021,Ad-choices for USA site
469571,UNBO-2020,Ad-choices for USA site
469570,UNBO-2019,Ad-choices for USA site
469541,UNBO-2261,Filter section: Results per page not organized after clicking
469465,UNBO-2018,Feature content is empty
469435,UNBO-2017,Sprint 28 automation tasks
469413,UNBO-2016,Stat grid is not centered
469385,UNBO-2015,h1 titles are now showing on page causing some duplication of titles
469245,UNBO-2014,Disable SonarQube running on QA and Main releases
469229,UNBO-2013,"Accessibility Hub - ""item type block not defined"""
469226,UNBO-2012,Playbook pages showing bugs and 'text block' bug
469219,UNBO-2011,Unwanted content on brand search page
469216,UNBO-2010,image in planet and society page is missing
469214,UNBO-2009,Test plan for Sanity v3 upgrade
469189,UNBO-2008,Upgrade repo to use NODE v18
469186,UNBO-2007,Extra margin is observed between  body block and card
469183,UNBO-2006,Playbook - layout / format of pages has changed
469115,UNBO-2005,Set uol-dev PUBLIC_SANITY_DATASET=production after IR release
469114,UNBO-2004,Update investors overview URL conditional for Percy and highcharts
469009,UNBO-2003,Revisit the benefits of Netlify logs versus Log Drains sent to New Relic
468983,UNBO-2002,Review for Automation - Sitemap bullet point icon list change
468982,UNBO-2001,Execute F/E tests - Sitemap bullet point icon list change
468981,UNBO-2000,Execute B/E tests - Sitemap bullet point icon list change
468980,UNBO-1999,Create F/E tests - Sitemap bullet point icon list change
468979,UNBO-1998,Create B/E tests - Sitemap bullet point icon list change
468892,UNBO-1997,DQM connector set up - corporate sites
468889,UNBO-1996,Review for Automation - SDG alt-text removal
468888,UNBO-1995,Execute B/E and F/E tests - SDG alt-text removal
468887,UNBO-1994,Create B/E and F/E tests - SDG alt-text removal
468880,UNBO-1993,DQM tab on Sanity - issue nÂº 12.7
468777,UNBO-1992,May' s Review TODOs in the codebase
468587,UNBO-1991,Revisit the Slack failure notifications rules
468568,UNBO-1990,Create a report on who is using the 'where schema is used' 
468418,UNBO-1989,Kazakhstan staging sites leading to 404 errors
468417,UNBO-1988,Add option to show no date on promo list 
468335,UNBO-1987,Missing subtitle for Goal Progress Box causes 500 error
468334,UNBO-1986,Security Vulnerability - SSL Certificate - Will Expire Soon
468332,UNBO-1985,"Security Vulnerability - Cookie Does Not Contain The ""secure"" Attribute"
468331,UNBO-1984,"Security Vulnerability - Cookie Does Not Contain The ""HTTPOnly"" Attribute"
468327,UNBO-1983,Security Vulnerability - Same site Scripting
468206,UNBO-1982,Baseline Percy Prod
468195,UNBO-1981,Update contact us forms
468131,UNBO-1980,Add New Relic test for alerts/contact forms
468104,UNBO-1979,GA is not recording data on the Location selector page
467908,UNBO-1978,Move SDGs to the bottom of the page
467777,UNBO-1977,There is an issue with dynamic preview sub language sites
467712,UNBO-1976,Fix url case incorrectly missing a conditional check
467595,UNBO-1975,Migrate the signup endpoints to Netlify functions.
467516,UNBO-1974,Upgrade to Cypress v12.5.0
467428,UNBO-1973,Set up new site for https://www.unileverconsumercarebd.com
467426,UNBO-1972,Set up dual language for Bangladesh (needs Bengali site set up) 
467405,UNBO-1971,screen Investigate the resolution used with Percy snapshots
467398,UNBO-1970,Reset Netlify env vars (QA U.com & UK) to production dataset
467397,UNBO-1969,Enhance the `monitor.json` to return BuildID
467362,UNBO-1968,'Equal columns' option for tables doesn't work for mobile
467314,UNBO-1967,Update Percy for automation pub
467298,UNBO-1966,Search is returning 0 results
467273,UNBO-1965,Add Netlify ping test retry to code to avoid firing too soon
467254,UNBO-1964,Add test for closing transcript modal with ESC button
467228,UNBO-1963,Update sanity for the investors pages
467227,UNBO-1962,Review preview sites for desktop
467047,UNBO-1961,Sprint 27 automation tasks
467015,UNBO-1960,GR Brands page - Brands appearing twice
466956,UNBO-1959,Leadership profile history dates are defaulting to year only
466954,UNBO-1958,Dates error
466842,UNBO-1957,Cookie policy - Address accessibility and performance issues 
466827,UNBO-1956,Improve asset previews
466824,UNBO-1955,Alt text mandatory rule review
466811,UNBO-1954,Annotation overhaul to improve naming conventions
466791,UNBO-1953,U.com news sign-up is failing intermittently
466764,UNBO-1952,Review keyboard nav to video transcripts
466758,UNBO-1951,Create test plan for Sanity V3 upgrade 
466757,UNBO-1950,Create spec for Sanity V3 upgrade 
466755,UNBO-1949,Sprint 26 automation tasks
466753,UNBO-1948,Phase 1 - Sanity V3 upgrade
466752,UNBO-1947,Publishing
466669,UNBO-1946,Nutrition is missing from Sub Navigation - Chrome
466646,UNBO-1945,Ability net: SDG image alt text is no longer required
466607,UNBO-1944,Section ID's should not start with a number
466601,UNBO-1943,Extend current monitoring tests to monitor the WIOP sites and check if there are no brands / products
466592,UNBO-1942,Add Referenced by to assets
